impound_no,Animal_ID,Data_Source,Record_Type,Link,Current_Location,Animal_Name,animal_type,Age,Animal_Gender,Animal_Breed,Animal_Color,Date,Date_Type,Obfuscated_Address,City,State,Zip,jurisdiction,obfuscated_latitude,obfuscated_longitude,Image,image_alt_text,Memo,Temperament
K20-124926,A605548,Regional Animal Services of King County,LOST,https://petharbor.com/PublicDetail.asp?searchtype=PUBFOUND&view=sysadm.v_animal&shelterlist='KING'&where=type&ID=2077327,LOST,Midnight,Dog,,Male,Miniature Pinscher,Unknown,01/14/2020 12:00:00 AM,Date Lost,#634,,,,JURISDICTION,,,https://petharbor.com/get_image.asp?RES=Detail&LOCATION=PUBLIC&ID=2077327,Image Copyright HLP Inc. 2020,,
K20-124710,A604632,Regional Animal Services of King County,FOUND,https://petharbor.com/PublicDetail.asp?searchtype=PUBFOUND&view=sysadm.v_animal&shelterlist='KING'&where=type&ID=2073353,In Public Home,,Cat,,Male,Domestic Shorthair,Brown,01/04/2020 12:00:00 AM,Date Found,17980 NE UNION HILL RD,,,,JURISDICTION,,,https://petharbor.com/get_image.asp?RES=Detail&LOCATION=PUBLIC&ID=2073353,Image Copyright HLP Inc. 2020,,
K20-124836,A605105,Regional Animal Services of King County,FOUND,https://kingcounty.gov/depts/regional-animal-services/about-us/overview.aspx,,,Dead Cat,NO AGE,Male,Domestic Longhair,Orange / White,01/11/2020 12:00:00 AM,Received on,47000 244TH AVE SE,ENUMCLAW,WA,98022,KING COUNTY,,,,Image Copyright HLP Inc. 2020,"Received on: 2020-01-11<p/> Found Near: 47000 244TH AVE SE, ENUMCLAW WA 98022<p/> Description: Orange / White Male Domestic Longhair Cat<p/> Age: NO AGE<p/>",
K20-125061,A606080,Regional Animal Services of King County,ADOPTABLE,https://kingcounty.gov/depts/regional-animal-services/about-us/overview.aspx,In RASKC Foster Home,Mosie,Dog,10 YEARS,Neutered Male,Pomeranian,Tan,01/24/2020 12:00:00 AM,Received on,21615 64TH AVE S,KENT,WA,98032,SEATAC,47.407788,-122.255197,https://petharbor.com/get_image.asp?RES=Detail&LOCATION=KING&ID=A606080,Image Copyright HLP Inc. 2020,"Received on: 2020-01-24<p/> Description: Tan Neutered Male Pomeranian Dog<p/> Age: 10 YEARS<p/> Adoption Fee: $30.00<p/> Current Location: In RASKC Foster Home <p/>Hi! My name is Mosie and I am available for adoption.<p/><p/>I was brought in by an Animal Control Officer on 1/24/20 because my owner passed away.<p/><p/>My personality color is GREEN. I am an adaptable dog who loves to go with the flow! I am outgoing and carefree, and I just can't wait to find my forever home! I am a gentle and loving dog who likes to take things slow and would need a forever home that understand i am an old boy who needs someone to be gentle with me.<p/><p/>I am an affectionate lovebug who would be thrilled to cuddle up with you at home! My caregivers have noticed that I seem to do well with other small older dogs. When meeting dogs in a new home, I would do best with a slow introduction. Because of my age i would prefer to be in a home with no children or older respectful children.<p/><p/>",GREEN
K19-124613,A604189,Regional Animal Services of King County,ADOPTABLE,https://petharbor.com/pet.asp?uaid=KING.A604189,"King County Pet Adoption Center 21615 64TH AVE S KENT, WA 98032",Trap,Dog,1 YEAR 5 MONTHS,Male,Pit Bull / Akita,Black / White,12/30/2019 12:00:00 AM,Received on,,,,,,,,https://petharbor.com/get_image.asp?RES=Detail&LOCATION=KING&ID=A604189,Image Copyright HLP Inc. 2020,"Received on: 2019-12-30<p/> Description: Black / White<p/>  Male Pit Bull / Akita Dog<p/> Age: 1 YEAR 5 MONTHS<p/> Adoption Fee: $100.00<p/> Current Location: King County Pet Adoption Center 21615 64TH AVE S KENT, WA 98032<p/>Hi! My name is Trap and I am available for adoption.<p/><p/>I was brought in by an Animal Control Officer on 12/30/19<p/><p/>My personality color is RED. I am a spirited dog with a fun-loving personality! I am still working on my manners, so I would do best with a family who is willing to work with me and help me become the best dog I can be!<p/><p/> I am a very smart dog! At the shelter I am practicing how to ""sit"" and ""down""<p/><p/>I am an affectionate lovebug who would be thrilled to cuddle up with you at home! I am full of energy and I love to play! I tend to calm down more when the people around me stay calm. I do best when I have lots of exercise and something to keep my mind busy. My caregivers have observed that I don't get along with other dogs. I may do best as the only dog in my new home, or need to meet other dogs in the home first. I would do best in a home with children who are comfortable with a jumping high energy pup like myself.Hi! My name is [name] and I am available for adoption.<p/><p/>",RED
K20-124693,A604519,Regional Animal Services of King County,LOST,https://petharbor.com/PublicDetail.asp?searchtype=PUBFOUND&view=sysadm.v_animal&shelterlist='KING'&where=type&ID=2072978,LOST,Brains,Cat,,Male,Domestic Shorthair,Unknown,01/03/2020 12:00:00 AM,Date Lost,16TH AVE S AND LUCILE ST,,,,JURISDICTION,,,https://petharbor.com/get_image.asp?RES=Detail&LOCATION=PUBLIC&ID=2072978,Image Copyright HLP Inc. 2020,,
K20-124731,A604683,Regional Animal Services of King County,FOUND,https://kingcounty.gov/depts/regional-animal-services/about-us/overview.aspx,,,Dead Dog,2 YEARS,Female,Australian Cattle Dog,Blue Merle,01/06/2020 12:00:00 AM,Received on,20800 SE 424TH ST,ENUMCLAW,WA,98022,KING COUNTY,47.221005,-122.064168,,Image Copyright HLP Inc. 2020,"Received on: 2020-01-06<p/> Found Near: 20800 SE 424TH ST, ENUMCLAW WA 98022<p/> Description: Blue Merle Female Australian Cattle Dog Dog<p/> Age: 2 YEARS<p/>",
K20-125003,A605873,Regional Animal Services of King County,LOST,https://petharbor.com/PublicDetail.asp?searchtype=PUBFOUND&view=sysadm.v_animal&shelterlist='KING'&where=type&ID=2079047,LOST,Rue,Dog,,Male,Chihuahua - Smooth Coated,Unknown,01/22/2020 12:00:00 AM,Date Lost,800 NW 85TH ST,SEATTLE,WA,98117,JURISDICTION,,,https://petharbor.com/get_image.asp?RES=Detail&LOCATION=PUBLIC&ID=2079047,Image Copyright HLP Inc. 2020,,
K20-124931,A605593,Regional Animal Services of King County,FOUND,https://petharbor.com/pet.asp?uaid=KING.A605593,"King County Pet Adoption Center 21615 64TH AVE S KENT, WA 98032",Pancake,Dog,12 YEARS,Neutered Male,Chihuahua - Smooth Coated,Brown,01/17/2020 12:00:00 AM,Received on,9600 14TH AVE SW,SEATTLE,WA,98106,KING COUNTY,,,https://petharbor.com/get_image.asp?RES=Detail&LOCATION=KING&ID=A605593,Image Copyright HLP Inc. 2020,"Received on: 2020-01-17<p/> Found Near: 9600 14TH AVE SW, SEATTLE WA 98106<p/> Description: Brown Neutered Male Chihuahua - Smooth Coated Dog<p/> Age: 12 YEARS<p/> Current Location: King County Pet Adoption Center 21615 64TH AVE S KENT, WA 98032<p/>",RED
K20-124699,A604525,Regional Animal Services of King County,LOST,https://petharbor.com/PublicDetail.asp?searchtype=PUBFOUND&view=sysadm.v_animal&shelterlist='KING'&where=type&ID=2073118,LOST,Hobbes,Cat,,Male,Domestic Mediumhair,Unknown,12/27/2019 12:00:00 AM,Date Lost,1286 173RD AVE NE,,,,JURISDICTION,,,https://petharbor.com/get_image.asp?RES=Detail&LOCATION=PUBLIC&ID=2073118,Image Copyright HLP Inc. 2020,,
K20-125125,A606230,Regional Animal Services of King County,LOST,https://petharbor.com/PublicDetail.asp?searchtype=PUBFOUND&view=sysadm.v_animal&shelterlist='KING'&where=type&ID=2080844,LOST,Midnight,Cat,,Female,Domestic Shorthair,Unknown,01/27/2020 12:00:00 AM,Date Lost,36211 SE SAINT ANDREWS LANE,,,,JURISDICTION,,,https://petharbor.com/get_image.asp?RES=Detail&LOCATION=PUBLIC&ID=2080844,Image Copyright HLP Inc. 2020,,
K20-124830,A605079,Regional Animal Services of King County,FOUND,https://petharbor.com/PublicDetail.asp?searchtype=PUBFOUND&view=sysadm.v_animal&shelterlist='KING'&where=type&ID=2075319,In Public Home,,Dog,,Female,Rat Terrier,Black / White,01/10/2020 12:00:00 AM,Date Found,BOTHELL WAY AND 39TH,,,,JURISDICTION,,,https://petharbor.com/get_image.asp?RES=Detail&LOCATION=PUBLIC&ID=2075319,Image Copyright HLP Inc. 2020,,
K19-124495,A603821,Regional Animal Services of King County,ADOPTABLE,https://kingcounty.gov/depts/regional-animal-services/about-us/overview.aspx,In RASKC Foster Home,Cinnamon,Rabbit Sh,1 YEAR 1 MONTH,Spayed Female,Rabbit Sh,Tan,12/23/2019 12:00:00 AM,Received on,21615 64TH AVE S,KENT,WA,98032,KING COUNTY,47.407788,-122.255197,https://petharbor.com/get_image.asp?RES=Detail&LOCATION=KING&ID=A603821,Image Copyright HLP Inc. 2020,"Received on: 2019-12-23<p/> Description: Tan Spayed Female Rabbit Sh Rabbit Sh<p/> Age: 1 YEAR 1 MONTH<p/> Adoption Fee: An Adoption Fee has not been set. Please inquire with the shelter.<p/> Current Location: In RASKC Foster Home <p/>Hi! My name is Cinnamon and I am available for adoption. I was brought in by a good samaritan on 12/23/19.<p/><p/>I have spent some time in foster care and my foster family says I am a shy but sweet girl! I do not jump on the furniture but I like to follow my people around the house. I am pretty calm and I don't mind being held. I ignore the guinea pig in the house and I seem to do well with small children. <p/><p/>I am living with my rabbit friend, Coco, in foster care. We get along great and we would love to go home together! <p/><p/>My personality color is BLUE. I am a gentle and loving bunny who likes to take things slow. I may get nervous in new situations, so I am looking for a family who understands that I might need some time to warm up. Once I get to know you, I will be a very devoted friend!<p/><p/><p/>",
K20-125168,A606461,Regional Animal Services of King County,LOST,https://petharbor.com/PublicDetail.asp?searchtype=PUBFOUND&view=sysadm.v_animal&shelterlist='KING'&where=type&ID=2081382,LOST,Loki,Bird,,,Fowl,Unknown,01/14/2020 12:00:00 AM,Date Lost,6025B 156TH ST SW,EDMONDS,WA,98026,JURISDICTION,,,https://petharbor.com/get_image.asp?RES=Detail&LOCATION=PUBLIC&ID=2081382,Image Copyright HLP Inc. 2020,,
K20-124929,A605584,Regional Animal Services of King County,FOUND,https://petharbor.com/pet.asp?uaid=KING.A605584,"King County Pet Adoption Center 21615 64TH AVE S KENT, WA 98032",T Bone,Dog,8 YEARS,Neutered Male,Boxer / Chow Chow,Red / White,01/17/2020 12:00:00 AM,Received on,19100 SE COVINGTON SAWYER RD,KENT,WA,98042,KING COUNTY,,,https://petharbor.com/get_image.asp?RES=Detail&LOCATION=KING&ID=A605584,Image Copyright HLP Inc. 2020,"Received on: 2020-01-17<p/> Found Near: 19100 SE COVINGTON SAWYER RD, KENT WA 98042<p/> Description: Red / White Neutered Male Boxer / Chow Chow Dog<p/> Age: 8 YEARS<p/> Current Location: King County Pet Adoption Center 21615 64TH AVE S KENT, WA 98032<p/>",RED
K20-125155,A606381,Regional Animal Services of King County,FOUND,https://kingcounty.gov/depts/regional-animal-services/about-us/overview.aspx,,,Dead Cat,NO AGE,Male,Domestic Shorthair,Brn Tabby / Black,01/28/2020 12:00:00 AM,Received on,28000 108TH AVE SE,AUBURN,WA,98092,AUBURN,,,,Image Copyright HLP Inc. 2020,"Received on: 2020-01-28<p/> Found Near: 28000 108TH AVE SE, AUBURN WA 98092<p/> Description: Brn Tabby / Black Male Domestic Shorthair Cat<p/> Age: NO AGE<p/>",
K19-124473,A603753,Regional Animal Services of King County,LOST,https://petharbor.com/PublicDetail.asp?searchtype=PUBFOUND&view=sysadm.v_animal&shelterlist='KING'&where=type&ID=2068251,LOST,Juniper,Dog,,Female,Border Collie,Unknown,12/21/2019 12:00:00 AM,Date Lost,156TH AND 198TH ST,,,,JURISDICTION,,,https://petharbor.com/get_image.asp?RES=Detail&LOCATION=PUBLIC&ID=2068251,Image Copyright HLP Inc. 2020,,
K20-125217,A606616,Regional Animal Services of King County,FOUND,https://petharbor.com/pet.asp?uaid=KING.A606616,"King County Pet Adoption Center 21615 64TH AVE S KENT, WA 98032",,Cat,7 MONTHS,Female,Siamese,Lynx Pt,02/01/2020 12:00:00 AM,Received on,3200 S 137TH ST,TUKWILA,WA,98168,TUKWILA,,,https://petharbor.com/get_image.asp?RES=Detail&LOCATION=KING&ID=A606616,Image Copyright HLP Inc. 2020,"Received on: 2020-02-01<p/> Found Near: 3200 S 137TH ST, TUKWILA WA 98168<p/> Description: Lynx Pt Female Siamese Cat<p/> Age: 7 MONTHS<p/> Current Location: King County Pet Adoption Center 21615 64TH AVE S KENT, WA 98032<p/>",
K19-124615,A604189,Regional Animal Services of King County,LOST,https://petharbor.com/PublicDetail.asp?searchtype=PUBFOUND&view=sysadm.v_animal&shelterlist='KING'&where=type&ID=2071137,LOST,Trap,Dog,,Male,Pit Bull / Akita,Black / White,12/30/2019 12:00:00 AM,Date Lost,20902 MILITARY ROAD S,,,,JURISDICTION,,,https://petharbor.com/get_image.asp?RES=Detail&LOCATION=PUBLIC&ID=2071137,Image Copyright HLP Inc. 2020,,RED
K20-125008,A605936,Regional Animal Services of King County,FOUND,https://kingcounty.gov/depts/regional-animal-services/about-us/overview.aspx,In RASKC Foster Home,,Cat,1 WEEK,Unaltered,Domestic Shorthair,Black / White,01/21/2020 12:00:00 AM,Received on,400 W CLOUDY ST,KENT,WA,98032,KENT,,,https://petharbor.com/get_image.asp?RES=Detail&LOCATION=KING&ID=A605936,Image Copyright HLP Inc. 2020,"Received on: 2020-01-21<p/> Found Near: 400 W CLOUDY ST, KENT WA 98032<p/> Description: Black / White Unaltered Domestic Shorthair Cat<p/> Age: 1 WEEK<p/> Current Location: In RASKC Foster Home <p/>",
K20-124826,A605069,Regional Animal Services of King County,FOUND,https://kingcounty.gov/depts/regional-animal-services/about-us/overview.aspx,,,Dead Cat,NO AGE,Unaltered,Domestic Shorthair,Black,01/10/2020 12:00:00 AM,Received on,3200 S 146TH ST,SEATAC,WA,98168,SEATAC,,,,Image Copyright HLP Inc. 2020,"Received on: 2020-01-10<p/> Found Near: 3200 S 146TH ST, SEATAC WA 98168<p/> Description: Black Unaltered Domestic Shorthair Cat<p/> Age: NO AGE<p/>",
K19-124589,A604131,Regional Animal Services of King County,LOST,https://petharbor.com/PublicDetail.asp?searchtype=PUBFOUND&view=sysadm.v_animal&shelterlist='KING'&where=type&ID=2070756,LOST,Theo,Cat,,Male,Domestic Shorthair,Unknown,12/23/2019 12:00:00 AM,Date Lost,1338 BLAINE AVE NE,,,,JURISDICTION,,,https://petharbor.com/get_image.asp?RES=Detail&LOCATION=PUBLIC&ID=2070756,Image Copyright HLP Inc. 2020,,
K19-124621,A604243,Regional Animal Services of King County,LOST,https://petharbor.com/PublicDetail.asp?searchtype=PUBFOUND&view=sysadm.v_animal&shelterlist='KING'&where=type&ID=2071210,LOST,Brooks,Dog,,Male,Golden Retriever,Unknown,12/31/2019 12:00:00 AM,Date Lost,32545 240TH AVE SE,,,,JURISDICTION,,,https://petharbor.com/get_image.asp?RES=Detail&LOCATION=PUBLIC&ID=2071210,Image Copyright HLP Inc. 2020,,
K20-125193,A606546,Regional Animal Services of King County,LOST,https://petharbor.com/PublicDetail.asp?searchtype=PUBFOUND&view=sysadm.v_animal&shelterlist='KING'&where=type&ID=2082008,LOST,Ayla,Dog,,Female,Jack Russell Terrier,Unknown,01/30/2020 12:00:00 AM,Date Lost,17500 34TH AVENUE S,,,,JURISDICTION,,,https://petharbor.com/get_image.asp?RES=Detail&LOCATION=PUBLIC&ID=2082008,Image Copyright HLP Inc. 2020,,
K20-125137,A606301,Regional Animal Services of King County,LOST,https://petharbor.com/PublicDetail.asp?searchtype=PUBFOUND&view=sysadm.v_animal&shelterlist='KING'&where=type&ID=2080899,LOST,Hamilton,Cat,,Male,Pixiebob Shorthair,Unknown,01/23/2020 12:00:00 AM,Date Lost,20812 MAXWELL RD SE,,,,JURISDICTION,,,https://petharbor.com/get_image.asp?RES=Detail&LOCATION=PUBLIC&ID=2080899,Image Copyright HLP Inc. 2020,,
K20-125150,A606356,Regional Animal Services of King County,FOUND,https://petharbor.com/pet.asp?uaid=KING.A606356,"King County Pet Adoption Center 21615 64TH AVE S KENT, WA 98032",,Goat,NO AGE,Male,Goat,Black / Gray,01/28/2020 12:00:00 AM,Received on,19100 SE 295TH ST,KENT,WA,98042,KING COUNTY,,,https://petharbor.com/get_image.asp?RES=Detail&LOCATION=KING&ID=A606356,Image Copyright HLP Inc. 2020,"Received on: 2020-01-28<p/> Found Near: 19100 SE 295TH ST, KENT WA 98042<p/> Description: Black / Gray Male Goat Goat<p/> Age: NO AGE<p/> Current Location: King County Pet Adoption Center 21615 64TH AVE S KENT, WA 98032<p/>",
K19-124539,A604016,Regional Animal Services of King County,ADOPTABLE,https://kingcounty.gov/depts/regional-animal-services/about-us/overview.aspx,In RASKC Foster Home,Coco,Rabbit Sh,9 MONTHS,Neutered Male,Rabbit Sh / Rex,Buff,12/27/2019 12:00:00 AM,Received on,21615 64TH AVE S,KENT,WA,98032,SEATAC,47.407788,-122.255197,https://petharbor.com/get_image.asp?RES=Detail&LOCATION=KING&ID=A604016,Image Copyright HLP Inc. 2020,"Received on: 2019-12-27<p/> Description: Buff Neutered Male Rabbit Sh / Rex Rabbit Sh<p/> Age: 9 MONTHS<p/> Adoption Fee: $30.00<p/> Current Location: In RASKC Foster Home <p/>Hi! My name is Coco and I am available for adoption. I was brought in by my previous owner on December 27, 2019 because they could no longer care for me. I have lived with children before and I seem to do well with them. My previous owner described me as very sweet. <p/><p/>I have spent some time in foster care and my foster family describes me as very bright. I love to follow my favorite people around and lay down at their feet. They say that I am very clean and that I love petting and being near you all the time. They also said I am very active and curious about other animals.<p/><p/>I am living with my friend, Cinnamon, in foster care. We get along great and we would love to go home together! <p/><p/>My personality color is GREEN. I am an adaptable rabbit who loves to go with the flow! I am outgoing and carefree, and I just can't wait to find my forever home!<p/><p/>",GREEN
K20-124781,A604876,Regional Animal Services of King County,FOUND,https://petharbor.com/PublicDetail.asp?searchtype=PUBFOUND&view=sysadm.v_animal&shelterlist='KING'&where=type&ID=2074481,In Public Home,,Dog,,Female,German Shepherd,Unknown,01/07/2020 12:00:00 AM,Date Found,,,,,JURISDICTION,,,https://petharbor.com/get_image.asp?RES=Detail&LOCATION=PUBLIC&ID=2074481,Image Copyright HLP Inc. 2020,,
K19-124565,A604083,Regional Animal Services of King County,LOST,https://petharbor.com/PublicDetail.asp?searchtype=PUBFOUND&view=sysadm.v_animal&shelterlist='KING'&where=type&ID=2070291,LOST,Jake,Cat,,Male,Domestic Shorthair,Unknown,12/28/2019 12:00:00 AM,Date Lost,14200 SE 272ND ST #C102,,,,JURISDICTION,,,https://petharbor.com/get_image.asp?RES=Detail&LOCATION=PUBLIC&ID=2070291,Image Copyright HLP Inc. 2020,,
K20-125085,A606119,Regional Animal Services of King County,ADOPTABLE,https://petharbor.com/pet.asp?uaid=KING.A606119,"Kirkland Petco 12040 NE 85TH ST KIRKLAND, WA 98033",Fancy Face,Cat,5 YEARS 6 MONTHS,Spayed Female,Domestic Shorthair,Tortie / White,01/25/2020 12:00:00 AM,Received on,12040 NE 85TH ST,KIRKLAND,WA,98033,KIRKLAND,47.680519,-122.179195,https://petharbor.com/get_image.asp?RES=Detail&LOCATION=KING&ID=A606119,Image Copyright HLP Inc. 2020,"Received on: 2020-01-25<p/> Description: Tortie / White<p/>  Spayed Female Domestic Shorthair Cat<p/> Age: 5 YEARS 6 MONTHS<p/> Adoption Fee: $30.00<p/> Current Location: Kirkland Petco 12040 NE 85TH ST KIRKLAND, WA 98033<p/>Hi! My name is Fancy Face and I am available for adoption.<p/><p/>I was brought in by a good samaritan on January 25th, 2020. <p/><p/>I'm still a little shy here in the shelter but with some time and TLC, I quickly come out of my shell and love to receive love. I'm a big time snuggler looking for a nice, warm lap to call my own. <p/><p/>My personality color is BLUE. I am a gentle and loving cat who likes to take things slow. I may get nervous in new situations, so I am looking for a family who understands that I might need some time to warm up. Once I get to know you, I will be a very devoted friend!<p/><p/><p/>",BLUE
K20-125089,A606122,Regional Animal Services of King County,LOST,https://petharbor.com/PublicDetail.asp?searchtype=PUBFOUND&view=sysadm.v_animal&shelterlist='KING'&where=type&ID=2080340,LOST,"Qoya, Koya,",Dog,,Female,Labrador Retriever,Unknown,01/25/2020 12:00:00 AM,Date Lost,410 SW 108TH ST,,,,JURISDICTION,,,https://petharbor.com/get_image.asp?RES=Detail&LOCATION=PUBLIC&ID=2080340,Image Copyright HLP Inc. 2020,,
K19-124588,A604130,Regional Animal Services of King County,LOST,https://petharbor.com/PublicDetail.asp?searchtype=PUBFOUND&view=sysadm.v_animal&shelterlist='KING'&where=type&ID=2070715,LOST,Dusty,Cat,,Male,Domestic Shorthair,Black,12/26/2019 12:00:00 AM,Date Lost,SE 240TH STREET,,,,JURISDICTION,,,https://petharbor.com/get_image.asp?RES=Detail&LOCATION=PUBLIC&ID=2070715,Image Copyright HLP Inc. 2020,,
K20-124819,A605050,Regional Animal Services of King County,LOST,https://petharbor.com/PublicDetail.asp?searchtype=PUBFOUND&view=sysadm.v_animal&shelterlist='KING'&where=type&ID=2075082,LOST,Pele,Cat,,Male,Domestic Shorthair,Unknown,01/08/2020 12:00:00 AM,Date Lost,SE 59TH STREET AND LAKE WASHINGTON BLVD,,,,JURISDICTION,,,https://petharbor.com/get_image.asp?RES=Detail&LOCATION=PUBLIC&ID=2075082,Image Copyright HLP Inc. 2020,,
K20-125245,A066715,Regional Animal Services of King County,FOUND,https://petharbor.com/pet.asp?uaid=KING.A066715,"King County Pet Adoption Center 21615 64TH AVE S KENT, WA 98032",Xena,Dog,11 YEARS 3 MONTHS,Spayed Female,Jack Russell Terrier,White / Brown,02/03/2020 12:00:00 AM,Received on,6900 S 123RD ST,SEATTLE,WA,98178,KING COUNTY,,,https://petharbor.com/get_image.asp?RES=Detail&LOCATION=KING&ID=A066715,Image Copyright HLP Inc. 2020,"Received on: 2020-02-03<p/> Found Near: 6900 S 123RD ST, SEATTLE WA 98178<p/> Description: White / Brown Spayed Female Jack Russell Terrier Dog<p/> Age: 11 YEARS 3 MONTHS<p/> Current Location: King County Pet Adoption Center 21615 64TH AVE S KENT, WA 98032<p/>",
K19-124490,A603805,Regional Animal Services of King County,LOST,https://petharbor.com/PublicDetail.asp?searchtype=PUBFOUND&view=sysadm.v_animal&shelterlist='KING'&where=type&ID=2068635,LOST,Smokey,Dog,,Male,Rottweiler,Unknown,12/23/2019 12:00:00 AM,Date Lost,INTER URBAN 48TH STR,,,,JURISDICTION,,,https://petharbor.com/get_image.asp?RES=Detail&LOCATION=PUBLIC&ID=2068635,Image Copyright HLP Inc. 2020,,
K20-125062,A606082,Regional Animal Services of King County,LOST,https://petharbor.com/PublicDetail.asp?searchtype=PUBFOUND&view=sysadm.v_animal&shelterlist='KING'&where=type&ID=2079940,LOST,Finn,Dog,,Male,Labrador Retriever,Unknown,01/24/2020 12:00:00 AM,Date Lost,6257 164TH AVE SE,,,,JURISDICTION,,,https://petharbor.com/get_image.asp?RES=Detail&LOCATION=PUBLIC&ID=2079940,Image Copyright HLP Inc. 2020,,
K19-124472,A603752,Regional Animal Services of King County,LOST,https://petharbor.com/PublicDetail.asp?searchtype=PUBFOUND&view=sysadm.v_animal&shelterlist='KING'&where=type&ID=2068245,LOST,Bruiser,Dog,,Male,Rottweiler,Unknown,12/21/2019 12:00:00 AM,Date Lost,19100 34TH AVE S.,,,,JURISDICTION,,,https://petharbor.com/get_image.asp?RES=Detail&LOCATION=PUBLIC&ID=2068245,Image Copyright HLP Inc. 2020,,
K20-125236,A606642,Regional Animal Services of King County,FOUND,https://petharbor.com/pet.asp?uaid=KING.A606642,"King County Pet Adoption Center 21615 64TH AVE S KENT, WA 98032",,Cat,NO AGE,Unaltered,Domestic Shorthair,Tortie / White,02/02/2020 12:00:00 AM,Received on,400 PETERSEN DR E,ENUMCLAW,WA,98022,ENUMCLAW,,,https://petharbor.com/get_image.asp?RES=Detail&LOCATION=KING&ID=A606642,Image Copyright HLP Inc. 2020,"Received on: 2020-02-02<p/> Found Near: 400 PETERSEN DR E, ENUMCLAW WA 98022<p/> Description: Tortie / White Unaltered Domestic Shorthair Cat<p/> Age: NO AGE<p/> Current Location: King County Pet Adoption Center 21615 64TH AVE S KENT, WA 98032<p/>",
K20-124837,A605106,Regional Animal Services of King County,FOUND,https://petharbor.com/PublicDetail.asp?searchtype=PUBFOUND&view=sysadm.v_animal&shelterlist='KING'&where=type&ID=2075453,In Public Home,,Dog,,Male,Belgian Malinois,Brown / Black,01/11/2020 12:00:00 AM,Date Found,7412 117TH PL SE,,,,JURISDICTION,,,https://petharbor.com/get_image.asp?RES=Detail&LOCATION=PUBLIC&ID=2075453,Image Copyright HLP Inc. 2020,,
K20-125154,A606373,Regional Animal Services of King County,FOUND,https://petharbor.com/pet.asp?uaid=KING.A606373,"King County Pet Adoption Center 21615 64TH AVE S KENT, WA 98032",,Cat,9 MONTHS,Neutered Male,Domestic Longhair,Gray Tabby / White,01/28/2020 12:00:00 AM,Received on,6800 S 217TH ST,KENT,WA,98032,KENT,,,https://petharbor.com/get_image.asp?RES=Detail&LOCATION=KING&ID=A606373,Image Copyright HLP Inc. 2020,"Received on: 2020-01-28<p/> Found Near: 6800 S 217TH ST, KENT WA 98032<p/> Description: Gray Tabby / White Neutered Male Domestic Longhair Cat<p/> Age: 9 MONTHS<p/> Current Location: King County Pet Adoption Center 21615 64TH AVE S KENT, WA 98032<p/>",
K20-124920,A605526,Regional Animal Services of King County,LOST,https://petharbor.com/PublicDetail.asp?searchtype=PUBFOUND&view=sysadm.v_animal&shelterlist='KING'&where=type&ID=2077175,LOST,Bentley,Dog,,Male,Yorkshire Terrier,Unknown,01/13/2020 12:00:00 AM,Date Lost,EDMOND ST,,,,JURISDICTION,,,https://petharbor.com/get_image.asp?RES=Detail&LOCATION=PUBLIC&ID=2077175,Image Copyright HLP Inc. 2020,,
K20-124914,A605468,Regional Animal Services of King County,LOST,https://petharbor.com/PublicDetail.asp?searchtype=PUBFOUND&view=sysadm.v_animal&shelterlist='KING'&where=type&ID=2077045,LOST,Midnight,Dog,,Male,Miniature Pinscher,Unknown,01/14/2020 12:00:00 AM,Date Lost,00 HAYES PL SW RENTON,,WA,98057,JURISDICTION,,,https://petharbor.com/get_image.asp?RES=Detail&LOCATION=PUBLIC&ID=2077045,Image Copyright HLP Inc. 2020,,
K19-124527,A603939,Regional Animal Services of King County,LOST,https://petharbor.com/PublicDetail.asp?searchtype=PUBFOUND&view=sysadm.v_animal&shelterlist='KING'&where=type&ID=2069356,LOST,Hachy,Dog,,Male,Shih Tzu,Unknown,12/24/2019 12:00:00 AM,Date Lost,130 112 SW APT C105,,,,JURISDICTION,,,https://petharbor.com/get_image.asp?RES=Detail&LOCATION=PUBLIC&ID=2069356,Image Copyright HLP Inc. 2020,,
K20-124732,A604705,Regional Animal Services of King County,LOST,https://petharbor.com/PublicDetail.asp?searchtype=PUBFOUND&view=sysadm.v_animal&shelterlist='KING'&where=type&ID=2073704,LOST,Mittens,Cat,,Male,Domestic Shorthair,Unknown,01/01/2020 12:00:00 AM,Date Lost,6552 49TH AVE SW,,,,JURISDICTION,,,https://petharbor.com/get_image.asp?RES=Detail&LOCATION=PUBLIC&ID=2073704,Image Copyright HLP Inc. 2020,,
K20-125209,A606596,Regional Animal Services of King County,FOUND,https://petharbor.com/pet.asp?uaid=KING.A606596,"King County Pet Adoption Center 21615 64TH AVE S KENT, WA 98032",Renji,Dog,1 YEAR,Male,Australian Shepherd / Golden Retriever,Red Merle,01/31/2020 12:00:00 AM,Received on,39600 AUBURN ENUMCLAW RD SE,AUBURN,WA,98092,KING COUNTY,,,https://petharbor.com/get_image.asp?RES=Detail&LOCATION=KING&ID=A606596,Image Copyright HLP Inc. 2020,"Received on: 2020-01-31<p/> Found Near: 39600 AUBURN ENUMCLAW RD SE, AUBURN WA 98092<p/> Description: Red Merle Male Australian Shepherd / Golden Retriever Dog<p/> Age: 1 YEAR<p/> Current Location: King County Pet Adoption Center 21615 64TH AVE S KENT, WA 98032<p/>",
K20-124983,A605800,Regional Animal Services of King County,FOUND,https://kingcounty.gov/depts/regional-animal-services/about-us/overview.aspx,In RASKC Foster Home,,Cat,2 YEARS,Female,Domestic Shorthair,Brn Tabby / White,01/21/2020 12:00:00 AM,Received on,400 W CLOUDY ST,KENT,WA,98032,KENT,,,https://petharbor.com/get_image.asp?RES=Detail&LOCATION=KING&ID=A605800,Image Copyright HLP Inc. 2020,"Received on: 2020-01-21<p/> Found Near: 400 W CLOUDY ST, KENT WA 98032<p/> Description: Brn Tabby / White Female Domestic Shorthair Cat<p/> Age: 2 YEARS<p/> Current Location: In RASKC Foster Home <p/>",
K20-125038,A606016,Regional Animal Services of King County,FOUND,https://petharbor.com/PublicDetail.asp?searchtype=PUBFOUND&view=sysadm.v_animal&shelterlist='KING'&where=type&ID=2079609,In Public Home,,Dog,,Female,Chihuahua - Long Haired,Brown / Brown,01/23/2020 12:00:00 AM,Date Found,600 ANDOVER PARK W,,,,JURISDICTION,,,https://petharbor.com/get_image.asp?RES=Detail&LOCATION=PUBLIC&ID=2079609,Image Copyright HLP Inc. 2020,,
K20-124773,A604846,Regional Animal Services of King County,FOUND,https://kingcounty.gov/depts/regional-animal-services/about-us/overview.aspx,,,Dead Cat,4 YEARS,Male,Domestic Mediumhair,Black / White,01/08/2020 12:00:00 AM,Received on,13600 NE 175TH ST,WOODINVILLE,WA,98072,WOODINVILLE,,,,Image Copyright HLP Inc. 2020,"Received on: 2020-01-08<p/> Found Near: 13600 NE 175TH ST, WOODINVILLE WA 98072<p/> Description: Black / White Male Domestic Mediumhair Cat<p/> Age: 4 YEARS<p/>",
K20-124960,A603898,Regional Animal Services of King County,FOUND,https://petharbor.com/pet.asp?uaid=KING.A603898,"King County Pet Adoption Center 21615 64TH AVE S KENT, WA 98032",Butter Ball,Dog,4 YEARS 1 MONTH,Neutered Male,German Shepherd,Black,01/18/2020 12:00:00 AM,Received on,11000 SE KENT KANGLEY RD,KENT,WA,98030,KENT,,,https://petharbor.com/get_image.asp?RES=Detail&LOCATION=KING&ID=A603898,Image Copyright HLP Inc. 2020,"Received on: 2020-01-18<p/> Found Near: 11000 SE KENT KANGLEY RD, KENT WA 98030<p/> Description: Black Neutered Male German Shepherd Dog<p/> Age: 4 YEARS 1 MONTH<p/> Current Location: King County Pet Adoption Center 21615 64TH AVE S KENT, WA 98032<p/>",GREEN
K20-125199,A606571,Regional Animal Services of King County,FOUND,https://petharbor.com/pet.asp?uaid=KING.A606571,"King County Pet Adoption Center 21615 64TH AVE S KENT, WA 98032",Amara,Dog,5 YEARS,Female,Cane Corso,Blue,01/31/2020 12:00:00 AM,Received on,4200 S 172ND ST,SEATAC,WA,98188,SEATAC,,,https://petharbor.com/get_image.asp?RES=Detail&LOCATION=KING&ID=A606571,Image Copyright HLP Inc. 2020,"Received on: 2020-01-31<p/> Found Near: 4200 S 172ND ST, SEATAC WA 98188<p/> Description: Blue Female Cane Corso Dog<p/> Age: 5 YEARS<p/> Current Location: King County Pet Adoption Center 21615 64TH AVE S KENT, WA 98032<p/>",
K20-124949,A605662,Regional Animal Services of King County,LOST,https://petharbor.com/PublicDetail.asp?searchtype=PUBFOUND&view=sysadm.v_animal&shelterlist='KING'&where=type&ID=2077841,LOST,Charlie,Dog,,Male,Lhasa Apso,Unknown,01/15/2020 12:00:00 AM,Date Lost,252 AND 129TH AVE,,,,JURISDICTION,,,https://petharbor.com/get_image.asp?RES=Detail&LOCATION=PUBLIC&ID=2077841,Image Copyright HLP Inc. 2020,,
K20-125146,A606330,Regional Animal Services of King County,LOST,https://petharbor.com/PublicDetail.asp?searchtype=PUBFOUND&view=sysadm.v_animal&shelterlist='KING'&where=type&ID=2081038,LOST,Guinness,Cat,,Male,Bombay,Unknown,01/27/2020 12:00:00 AM,Date Lost,12671 SE 169TH PLACE,,,,JURISDICTION,,,https://petharbor.com/get_image.asp?RES=Detail&LOCATION=PUBLIC&ID=2081038,Image Copyright HLP Inc. 2020,,
K20-125148,A606334,Regional Animal Services of King County,LOST,https://petharbor.com/PublicDetail.asp?searchtype=PUBFOUND&view=sysadm.v_animal&shelterlist='KING'&where=type&ID=2081052,LOST,Ozzy,Cat,,Male,American Shorthair,Unknown,01/27/2020 12:00:00 AM,Date Lost,308TH AND 10TH AVE,,,,JURISDICTION,,,https://petharbor.com/get_image.asp?RES=Detail&LOCATION=PUBLIC&ID=2081052,Image Copyright HLP Inc. 2020,,
K20-125179,A606487,Regional Animal Services of King County,LOST,https://petharbor.com/PublicDetail.asp?searchtype=PUBFOUND&view=sysadm.v_animal&shelterlist='KING'&where=type&ID=2081640,LOST,Peter,Cat,,Male,Domestic Shorthair,Unknown,01/28/2020 12:00:00 AM,Date Lost,NE LATIMER PL & NE 41ST ST,,,,JURISDICTION,,,https://petharbor.com/get_image.asp?RES=Detail&LOCATION=PUBLIC&ID=2081640,Image Copyright HLP Inc. 2020,,
K20-124865,A605202,Regional Animal Services of King County,LOST,https://petharbor.com/PublicDetail.asp?searchtype=PUBFOUND&view=sysadm.v_animal&shelterlist='KING'&where=type&ID=2076113,LOST,Jasper,Cat,,Male,Siamese,Unknown,01/12/2020 12:00:00 AM,Date Lost,NE 8TH ST & 140TH,MARTINE APAR,,,JURISDICTION,,,https://petharbor.com/get_image.asp?RES=Detail&LOCATION=PUBLIC&ID=2076113,Image Copyright HLP Inc. 2020,,
K20-124923,A605529,Regional Animal Services of King County,LOST,https://petharbor.com/PublicDetail.asp?searchtype=PUBFOUND&view=sysadm.v_animal&shelterlist='KING'&where=type&ID=2077220,LOST,Pele,Cat,,,Domestic Shorthair,Unknown,01/08/2020 12:00:00 AM,Date Lost,SE 59TH STREET AND LAKE WASHINGTON BLVD,,,,JURISDICTION,,,https://petharbor.com/get_image.asp?RES=Detail&LOCATION=PUBLIC&ID=2077220,Image Copyright HLP Inc. 2020,,
K20-124640,A604307,Regional Animal Services of King County,LOST,https://petharbor.com/PublicDetail.asp?searchtype=PUBFOUND&view=sysadm.v_animal&shelterlist='KING'&where=type&ID=2071736,LOST,Nona,Dog,,Female,Pit Bull,Unknown,01/01/2020 12:00:00 AM,Date Lost,15221 294TH AVE SE,,,,JURISDICTION,,,https://petharbor.com/get_image.asp?RES=Detail&LOCATION=PUBLIC&ID=2071736,Image Copyright HLP Inc. 2020,,
K19-124491,A603806,Regional Animal Services of King County,FOUND,https://petharbor.com/PublicDetail.asp?searchtype=PUBFOUND&view=sysadm.v_animal&shelterlist='KING'&where=type&ID=2068645,In Public Home,,Cat,,Female,Domestic Shorthair,Brown,12/21/2019 12:00:00 AM,Date Found,25025 SE 41ST DR,,,,JURISDICTION,,,https://petharbor.com/get_image.asp?RES=Detail&LOCATION=PUBLIC&ID=2068645,Image Copyright HLP Inc. 2020,,
K20-124845,A605110,Regional Animal Services of King County,FOUND,https://kingcounty.gov/depts/regional-animal-services/about-us/overview.aspx,,Fitzgerald,Dead Cat,NO AGE,Neutered Male,Bengal,Brown,01/11/2020 12:00:00 AM,Received on,7000 SE 20TH ST,MERCER ISLAND,WA,98040,MERCER ISLAND,,,,Image Copyright HLP Inc. 2020,"Received on: 2020-01-11<p/> Found Near: 7000 SE 20TH ST, MERCER ISLAND WA 98040<p/> Description: Brown Neutered Male Bengal Cat<p/> Age: NO AGE<p/>",
K19-124624,A604252,Regional Animal Services of King County,LOST,https://petharbor.com/PublicDetail.asp?searchtype=PUBFOUND&view=sysadm.v_animal&shelterlist='KING'&where=type&ID=2071293,LOST,Monty,Dog,,Male,American Pit Bull Terrier,Unknown,12/30/2019 12:00:00 AM,Date Lost,138TH & 6TH AVE SW,,,,JURISDICTION,,,https://petharbor.com/get_image.asp?RES=Detail&LOCATION=PUBLIC&ID=2071293,Image Copyright HLP Inc. 2020,,
K20-124753,A604781,Regional Animal Services of King County,LOST,https://petharbor.com/PublicDetail.asp?searchtype=PUBFOUND&view=sysadm.v_animal&shelterlist='KING'&where=type&ID=2073970,LOST,Bodhi,Dog,,Female,American Staffordshire,Unknown,01/04/2020 12:00:00 AM,Date Lost,1200 N LANDING WAY,RENTON,WA,98057,JURISDICTION,,,https://petharbor.com/get_image.asp?RES=Detail&LOCATION=PUBLIC&ID=2073970,Image Copyright HLP Inc. 2020,,
K20-125177,A606485,Regional Animal Services of King County,ADOPTABLE,https://petharbor.com/pet.asp?uaid=KING.A606485,"King County Pet Adoption Center 21615 64TH AVE S KENT, WA 98032",Seras,Dog,8 MONTHS,Female,Boxer / Mix,Br Brindle / White,01/29/2020 12:00:00 AM,Received on,,,,,,,,https://petharbor.com/get_image.asp?RES=Detail&LOCATION=KING&ID=A606485,Image Copyright HLP Inc. 2020,"Received on: 2020-01-29<p/> Description: Br Brindle / White<p/>  Female Boxer / Mix Dog<p/> Age: 8 MONTHS<p/> Adoption Fee: $250.00<p/> Current Location: King County Pet Adoption Center 21615 64TH AVE S KENT, WA 98032<p/>Hi! My name is Seras and I am available for adoption.<p/><p/>I was brought in by an Animal Control Officer on January 29, 2020.<p/><p/>I am an affectionate lovebug who would be thrilled to cuddle up with you at home! My caregivers have noticed that I seem to do well with other dogs. When meeting dogs in a new home, I would do best with a slow introduction.<p/><p/>My personality color is BLUE. I am a gentle and loving dog who likes to take things slow. I may get nervous in new situations, so I am looking for a family who understands that I might take some time to warm up. Once I get to know you, I will be a very devoted friend!<p/><p/><p/>",BLUE
K20-124874,A605270,Regional Animal Services of King County,LOST,https://petharbor.com/PublicDetail.asp?searchtype=PUBFOUND&view=sysadm.v_animal&shelterlist='KING'&where=type&ID=2076375,LOST,Bandit,Dog,,Male,Australian Cattle Dog / Labrador Retriever,White / Black,01/13/2020 12:00:00 AM,Date Lost,132ND AVE SE,,,,JURISDICTION,,,https://petharbor.com/get_image.asp?RES=Detail&LOCATION=PUBLIC&ID=2076375,Image Copyright HLP Inc. 2020,,
K20-124766,A604785,Regional Animal Services of King County,FOUND,https://kingcounty.gov/depts/regional-animal-services/about-us/overview.aspx,,,Dead Sheep,NO AGE,Male,Sheep,White,01/07/2020 12:00:00 AM,Received on,4200 S 170TH ST,SEATAC,WA,98188,SEATAC,,,,Image Copyright HLP Inc. 2020,"Received on: 2020-01-07<p/> Found Near: 4200 S 170TH ST, SEATAC WA 98188<p/> Description: White Male Sheep Sheep<p/> Age: NO AGE<p/>",
K20-125121,A606196,Regional Animal Services of King County,FOUND,https://kingcounty.gov/depts/regional-animal-services/about-us/overview.aspx,,,Dead Dog,11 YEARS,Female,Chihuahua - Smooth Coated,White / Tan,01/27/2020 12:00:00 AM,Received on,1400 W MEEKER ST,KENT,WA,98032,KENT,,,,Image Copyright HLP Inc. 2020,"Received on: 2020-01-27<p/> Found Near: 1400 W MEEKER ST, KENT WA 98032<p/> Description: White / Tan Female Chihuahua - Smooth Coated Dog<p/> Age: 11 YEARS<p/>",
K20-125063,A606081,Regional Animal Services of King County,ADOPTABLE,https://petharbor.com/pet.asp?uaid=KING.A606081,"Kirkland Petco 12040 NE 85TH ST KIRKLAND, WA 98033",Rebel,Cat,6 YEARS,Spayed Female,Domestic Shorthair,Tortie,01/24/2020 12:00:00 AM,Received on,12040 NE 85TH ST,KIRKLAND,WA,98033,KIRKLAND,47.680519,-122.179195,https://petharbor.com/get_image.asp?RES=Detail&LOCATION=KING&ID=A606081,Image Copyright HLP Inc. 2020,"Received on: 2020-01-24<p/> Description: Tortie<p/>  Spayed Female Domestic Shorthair Cat<p/> Age: 6 YEARS<p/> Adoption Fee: $30.00<p/> Current Location: Kirkland Petco 12040 NE 85TH ST KIRKLAND, WA 98033<p/>Hi! My name is Rebel and I am available for adoption.<p/><p/>I was brought in by an Animal Control Officer on 1/24/20.  My owner passed away.<p/><p/>My personality color is RED. I am a spirited cat with a fun-loving personality! I may be sensitive to handling, so I would do best in a home with a cat savvy family who knows when to give me some space.<p/><p/>I am an independent kitty who likes to do my own thing!<p/><p/>I like getting attention on my own terms. I can get overstimulated with petting, so please move carefully with me and keep an eye out for signs that I might need a break.<p/><p/>Because of my shy nature, I would do best in a calm, quiet home.<p/><p/><p/>",RED
K19-124528,A603940,Regional Animal Services of King County,LOST,https://petharbor.com/PublicDetail.asp?searchtype=PUBFOUND&view=sysadm.v_animal&shelterlist='KING'&where=type&ID=2069373,LOST,Willie,Cat,,Male,American Shorthair,Unknown,12/23/2019 12:00:00 AM,Date Lost,26TH & 109TH,,,,JURISDICTION,,,https://petharbor.com/get_image.asp?RES=Detail&LOCATION=PUBLIC&ID=2069373,Image Copyright HLP Inc. 2020,,
K20-124860,A605161,Regional Animal Services of King County,LOST,https://petharbor.com/PublicDetail.asp?searchtype=PUBFOUND&view=sysadm.v_animal&shelterlist='KING'&where=type&ID=2075951,LOST,Marley,Cat,,Male,Domestic Shorthair,Unknown,01/10/2020 12:00:00 AM,Date Lost,31617 298TH AVENUE SOUTHEAST,,,,JURISDICTION,,,https://petharbor.com/get_image.asp?RES=Detail&LOCATION=PUBLIC&ID=2075951,Image Copyright HLP Inc. 2020,,
K20-124932,A605594,Regional Animal Services of King County,LOST,https://petharbor.com/PublicDetail.asp?searchtype=PUBFOUND&view=sysadm.v_animal&shelterlist='KING'&where=type&ID=2077541,LOST,Buttercup,Cat,,Male,Domestic Shorthair,Unknown,01/17/2020 12:00:00 AM,Date Lost,250TH AND 41ST,,,,JURISDICTION,,,https://petharbor.com/get_image.asp?RES=Detail&LOCATION=PUBLIC&ID=2077541,Image Copyright HLP Inc. 2020,,
K20-125186,A525135,Regional Animal Services of King County,FOUND,https://petharbor.com/pet.asp?uaid=KING.A525135,"King County Pet Adoption Center 21615 64TH AVE S KENT, WA 98032",Kozie,Dog,3 YEARS 2 MONTHS,Spayed Female,English Bulldog,Bl Brindle / Red,01/30/2020 12:00:00 AM,Received on,24400 SE 440TH ST,ENUMCLAW,WA,98022,ENUMCLAW,,,https://petharbor.com/get_image.asp?RES=Detail&LOCATION=KING&ID=A525135,Image Copyright HLP Inc. 2020,"Received on: 2020-01-30<p/> Found Near: 24400 SE 440TH ST, ENUMCLAW WA 98022<p/> Description: Bl Brindle / Red Spayed Female English Bulldog Dog<p/> Age: 3 YEARS 2 MONTHS<p/> Current Location: King County Pet Adoption Center 21615 64TH AVE S KENT, WA 98032<p/>",
K19-124514,A603900,Regional Animal Services of King County,LOST,https://petharbor.com/PublicDetail.asp?searchtype=PUBFOUND&view=sysadm.v_animal&shelterlist='KING'&where=type&ID=2068951,LOST,Biga,Dog,,Female,Black Mouth Cur,Unknown,12/24/2019 12:00:00 AM,Date Lost,1611 N 175TH ST,,,,JURISDICTION,,,https://petharbor.com/get_image.asp?RES=Detail&LOCATION=PUBLIC&ID=2068951,Image Copyright HLP Inc. 2020,,
K20-124780,A604871,Regional Animal Services of King County,FOUND,https://kingcounty.gov/depts/regional-animal-services/about-us/overview.aspx,,,Dead Cat,8 YEARS,Male,Domestic Shorthair,Black / White,01/08/2020 12:00:00 AM,Received on,2400 NE DAPHNE ST,ISSAQUAH,WA,98029,ISSAQUAH,,,,Image Copyright HLP Inc. 2020,"Received on: 2020-01-08<p/> Found Near: 2400 NE DAPHNE ST, ISSAQUAH WA 98029<p/> Description: Black / White Male Domestic Shorthair Cat<p/> Age: 8 YEARS<p/>",
K20-125025,A605945,Regional Animal Services of King County,LOST,https://petharbor.com/PublicDetail.asp?searchtype=PUBFOUND&view=sysadm.v_animal&shelterlist='KING'&where=type&ID=2079362,LOST,Donna,Cat,,Female,Domestic Shorthair,Unknown,01/21/2020 12:00:00 AM,Date Lost,24207 SE 259TH CT,,,,JURISDICTION,,,https://petharbor.com/get_image.asp?RES=Detail&LOCATION=PUBLIC&ID=2079362,Image Copyright HLP Inc. 2020,,
K20-124913,A605455,Regional Animal Services of King County,FOUND,https://petharbor.com/PublicDetail.asp?searchtype=PUBFOUND&view=sysadm.v_animal&shelterlist='KING'&where=type&ID=2076998,In Public Home,,Dog,,Female,Beagle,Brown / Black,01/15/2020 12:00:00 AM,Date Found,14223 284TH PL NE,,,,JURISDICTION,,,https://petharbor.com/get_image.asp?RES=Detail&LOCATION=PUBLIC&ID=2076998,Image Copyright HLP Inc. 2020,,
K20-125126,A602881,Regional Animal Services of King County,FOUND,https://kingcounty.gov/depts/regional-animal-services/about-us/overview.aspx,,Roxanne,Dead Dog,8 YEARS 9 MONTHS,Spayed Female,Labrador Retriever / Australian Cattle Dog,Black / White,01/27/2020 12:00:00 AM,Received on,,4621 TO,TO,T AVE,CARNATION,,,,Image Copyright HLP Inc. 2020,Received on: 2020-01-27<p/> Found Near: 4600 TOLT AVE<p/> Description: Black / White Spayed Female Labrador Retriever / Australian Cattle Dog Dog<p/> Age: 8 YEARS 9 MONTHS<p/>,
K20-124897,A605389,Regional Animal Services of King County,LOST,https://petharbor.com/PublicDetail.asp?searchtype=PUBFOUND&view=sysadm.v_animal&shelterlist='KING'&where=type&ID=2076725,LOST,Griz,Dog,,Male,Anatolian Shepherd,Unknown,01/15/2020 12:00:00 AM,Date Lost,115TH PL SE,,,,JURISDICTION,,,https://petharbor.com/get_image.asp?RES=Detail&LOCATION=PUBLIC&ID=2076725,Image Copyright HLP Inc. 2020,,
K19-124189,A602235,Regional Animal Services of King County,ADOPTABLE,https://kingcounty.gov/depts/regional-animal-services/about-us/overview.aspx,In RASKC Foster Home,Rose,Cat,12 YEARS 1 MONTH,Spayed Female,Domestic Longhair,Black / White,12/09/2019 12:00:00 AM,Received on,21615 64TH AVE S,KENT,WA,98032,KING COUNTY,47.407788,-122.255197,https://petharbor.com/get_image.asp?RES=Detail&LOCATION=KING&ID=A602235,Image Copyright HLP Inc. 2020,"Received on: 2019-12-09<p/> Description: Black / White Spayed Female Domestic Longhair Cat<p/> Age: 12 YEARS 1 MONTH<p/> Adoption Fee: $30.00<p/> Current Location: In RASKC Foster Home <p/>Hi! My name is Rose and I am available for adoption.<p/><p/>I was brought in by a good samaritan on December 9, 2019.<p/><p/>I am an affectionate lovebug who would be thrilled to cuddle up with you at home! My favorite places to nap are on my foster dad's lap or on the comfy bed! When I am not napping a enjoy eating dry food even though I have only a few teeth left!<p/><p/>I am a sweet girl who is a little shy at first but will warm up quick and steal your heart!<p/><p/>My personality color is BLUE. I am a gentle and loving cat who likes to take things slow. I may get nervous in new situations, so I am looking for a family who understands that I might need some time to warm up. Once I get to know you, I will be a very devoted friend!<p/>",BLUE
K20-124960,A603898,Regional Animal Services of King County,ADOPTABLE,https://petharbor.com/pet.asp?uaid=KING.A603898,"King County Pet Adoption Center 21615 64TH AVE S KENT, WA 98032",Butter Ball,Dog,4 YEARS 1 MONTH,Neutered Male,German Shepherd,Black,01/18/2020 12:00:00 AM,Received on,,,,,,,,https://petharbor.com/get_image.asp?RES=Detail&LOCATION=KING&ID=A603898,Image Copyright HLP Inc. 2020,"Received on: 2020-01-18<p/> Description: Black<p/>  Neutered Male German Shepherd Dog<p/> Age: 4 YEARS 1 MONTH<p/> Adoption Fee: $250.00<p/> Current Location: King County Pet Adoption Center 21615 64TH AVE S KENT, WA 98032<p/>Hi! My name is Butterball and I am available for adoption.<p/><p/>I was brought in by a good samaritan on January 18, 2020.<p/><p/>Butterball?! You mean giant goofball! That is what I am. I am just so happy all the time and will let you know it! I'm not quite aware of just how big I am and it is a shock when I jump up on and against you, but I am just trying to tell you how excited I am to meet you! I would love to partake in positive reinforcement training to learn how to be the best dog I can be!<p/><p/>I am a very smart dog! At the shelter I am practicing how to ""sit"".<p/><p/>I am an affectionate lovebug who would be thrilled to cuddle up with you at home!<p/><p/>I am full of energy and I love to play! I tend to calm down more when the people around me stay calm. I do best when I have lots of exercise and something to keep my mind busy.<p/><p/>My caregivers have noticed that I seem to do well with other dogs my size that are okay with how pushy I am when we first meet. When meeting dogs in a new home, I would do best with a slow introduction.<p/><p/>My personality color is GREEN. I am an adaptable dog who loves to go with the flow! I am outgoing and carefree, and I just can't wait to find my forever home!<p/><p/>",GREEN
K20-124862,A605199,Regional Animal Services of King County,LOST,https://petharbor.com/PublicDetail.asp?searchtype=PUBFOUND&view=sysadm.v_animal&shelterlist='KING'&where=type&ID=2076060,LOST,Autumn,Cat,,Female,Domestic Shorthair,Unknown,01/10/2020 12:00:00 AM,Date Lost,37905 250TH AVE SE,,,,JURISDICTION,,,https://petharbor.com/get_image.asp?RES=Detail&LOCATION=PUBLIC&ID=2076060,Image Copyright HLP Inc. 2020,,
K20-124816,A605024,Regional Animal Services of King County,FOUND,https://kingcounty.gov/depts/regional-animal-services/about-us/overview.aspx,,,Dead Cat,NO AGE,Female,Domestic Shorthair,Black / White,01/09/2020 12:00:00 AM,Received on,12900 SE 192ND ST,RENTON,WA,98058,KING COUNTY,47.430388,-122.168129,,Image Copyright HLP Inc. 2020,"Received on: 2020-01-09<p/> Found Near: 12900 SE 192ND ST, RENTON WA 98058<p/> Description: Black / White Female Domestic Shorthair Cat<p/> Age: NO AGE<p/>",
K20-124769,A604790,Regional Animal Services of King County,FOUND,https://petharbor.com/PublicDetail.asp?searchtype=PUBFOUND&view=sysadm.v_animal&shelterlist='KING'&where=type&ID=2074223,In Public Home,Callie,Dog,,Spayed Female,Siberian Husky,Black / White,01/05/2020 12:00:00 AM,Date Found,000 00 00,NORTH BE,,,KING COUNTY,,,https://petharbor.com/get_image.asp?RES=Detail&LOCATION=PUBLIC&ID=2074223,Image Copyright HLP Inc. 2020,,
K20-124747,A604760,Regional Animal Services of King County,FOUND,https://kingcounty.gov/depts/regional-animal-services/about-us/overview.aspx,,,Dead Dog,3 YEARS,Female,German Shepherd,Black / Brown,01/06/2020 12:00:00 AM,Received on,19500 SE COVINGTON SAWYER RD,KENT,WA,98042,KING COUNTY,,,,Image Copyright HLP Inc. 2020,"Received on: 2020-01-06<p/> Found Near: 19500 SE COVINGTON SAWYER RD, KENT WA 98042<p/> Description: Black / Brown Female German Shepherd Dog<p/> Age: 3 YEARS<p/>",
K20-125230,A606635,Regional Animal Services of King County,FOUND,https://petharbor.com/pet.asp?uaid=KING.A606635,"King County Pet Adoption Center 21615 64TH AVE S KENT, WA 98032",,Cat,5 YEARS,Male,Domestic Longhair,Black,02/02/2020 12:00:00 AM,Received on,4300 S 300TH PL,AUBURN,WA,98001,KING COUNTY,,,https://petharbor.com/get_image.asp?RES=Detail&LOCATION=KING&ID=A606635,Image Copyright HLP Inc. 2020,"Received on: 2020-02-02<p/> Found Near: 4300 S 300TH PL, AUBURN WA 98001<p/> Description: Black Male Domestic Longhair Cat<p/> Age: 5 YEARS<p/> Current Location: King County Pet Adoption Center 21615 64TH AVE S KENT, WA 98032<p/>",
K19-124566,A604118,Regional Animal Services of King County,LOST,https://petharbor.com/PublicDetail.asp?searchtype=PUBFOUND&view=sysadm.v_animal&shelterlist='KING'&where=type&ID=2070552,LOST,Calvin,Dog,,Male,Chihuahua - Long Haired,Unknown,12/27/2019 12:00:00 AM,Date Lost,168TH AND 256TH,,,,JURISDICTION,,,https://petharbor.com/get_image.asp?RES=Detail&LOCATION=PUBLIC&ID=2070552,Image Copyright HLP Inc. 2020,,
K20-124902,A605422,Regional Animal Services of King County,LOST,https://petharbor.com/PublicDetail.asp?searchtype=PUBFOUND&view=sysadm.v_animal&shelterlist='KING'&where=type&ID=2076841,LOST,Muffin,Dog,,Male,Maltese,Unknown,01/14/2020 12:00:00 AM,Date Lost,4200 EAST MERCER WAY,,,,JURISDICTION,,,https://petharbor.com/get_image.asp?RES=Detail&LOCATION=PUBLIC&ID=2076841,Image Copyright HLP Inc. 2020,,
K20-125249,A606667,Regional Animal Services of King County,FOUND,https://petharbor.com/pet.asp?uaid=KING.A606667,"King County Pet Adoption Center 21615 64TH AVE S KENT, WA 98032",Marley,Dog,12 YEARS 2 MONTHS,Spayed Female,Golden Retriever / Australian Shepherd,Gold / White,02/03/2020 12:00:00 AM,Received on,6900 S 123RD ST,SEATTLE,WA,98178,KING COUNTY,0,0,https://petharbor.com/get_image.asp?RES=Detail&LOCATION=KING&ID=A606667,Image Copyright HLP Inc. 2020,"Received on: 2020-02-03<p/> Found Near: 6900 S 123RD ST, SEATTLE WA 98178<p/> Description: Gold / White Spayed Female Golden Retriever / Australian Shepherd Dog<p/> Age: 12 YEARS 2 MONTHS<p/> Current Location: King County Pet Adoption Center 21615 64TH AVE S KENT, WA 98032<p/>",
K20-124638,A604304,Regional Animal Services of King County,LOST,https://petharbor.com/PublicDetail.asp?searchtype=PUBFOUND&view=sysadm.v_animal&shelterlist='KING'&where=type&ID=2071653,LOST,Sugar,Cat,,Male,Domestic Shorthair,Unknown,12/29/2019 12:00:00 AM,Date Lost,2001 DAYTON AVE NE,,,,JURISDICTION,,,https://petharbor.com/get_image.asp?RES=Detail&LOCATION=PUBLIC&ID=2071653,Image Copyright HLP Inc. 2020,,
K20-124984,A605806,Regional Animal Services of King County,LOST,https://petharbor.com/PublicDetail.asp?searchtype=PUBFOUND&view=sysadm.v_animal&shelterlist='KING'&where=type&ID=2078820,LOST,None,Cat,,Male,Domestic Shorthair,Unknown,01/21/2020 12:00:00 AM,Date Lost,N 147TH & AURORA AVE N (NEAR JIFFY LUBE),,,,JURISDICTION,,,https://petharbor.com/get_image.asp?RES=Detail&LOCATION=PUBLIC&ID=2078820,Image Copyright HLP Inc. 2020,,
K20-124878,A605303,Regional Animal Services of King County,FOUND,https://petharbor.com/PublicDetail.asp?searchtype=PUBFOUND&view=sysadm.v_animal&shelterlist='KING'&where=type&ID=2076468,In Public Home,,Dog,,,Pit Bull,Brown,01/13/2020 12:00:00 AM,Date Found,27314 24TH PLACE SOUTH,,,,JURISDICTION,,,https://petharbor.com/get_image.asp?RES=Detail&LOCATION=PUBLIC&ID=2076468,Image Copyright HLP Inc. 2020,,
K20-124921,A605527,Regional Animal Services of King County,LOST,https://petharbor.com/PublicDetail.asp?searchtype=PUBFOUND&view=sysadm.v_animal&shelterlist='KING'&where=type&ID=2077209,LOST,Munchington,Dog,,Male,Lhasa Apso,Unknown,01/16/2020 12:00:00 AM,Date Lost,D102,,,,JURISDICTION,,,https://petharbor.com/get_image.asp?RES=Detail&LOCATION=PUBLIC&ID=2077209,Image Copyright HLP Inc. 2020,,
K20-125202,A606577,Regional Animal Services of King County,FOUND,https://petharbor.com/pet.asp?uaid=KING.A606577,"King County Pet Adoption Center 21615 64TH AVE S KENT, WA 98032",Catsy Cline,Cat,5 YEARS,Female,Domestic Shorthair,White / Calico,01/31/2020 12:00:00 AM,Received on,23300 114TH PL SE,KENT,WA,98031,KENT,,,https://petharbor.com/get_image.asp?RES=Detail&LOCATION=KING&ID=A606577,Image Copyright HLP Inc. 2020,"Received on: 2020-01-31<p/> Found Near: 23300 114TH PL SE, KENT WA 98031<p/> Description: White / Calico Female Domestic Shorthair Cat<p/> Age: 5 YEARS<p/> Current Location: King County Pet Adoption Center 21615 64TH AVE S KENT, WA 98032<p/>",
K20-125223,A606618,Regional Animal Services of King County,FOUND,https://petharbor.com/pet.asp?uaid=KING.A606618,"King County Pet Adoption Center 21615 64TH AVE S KENT, WA 98032",Gracie,Cat,6 YEARS,Spayed Female,Domestic Mediumhair,Gray / White,02/01/2020 12:00:00 AM,Received on,28100 MAPLE RIDGE WAY SE,MAPLE VALLEY,WA,98038,MAPLE VALLEY,,,https://petharbor.com/get_image.asp?RES=Detail&LOCATION=KING&ID=A606618,Image Copyright HLP Inc. 2020,"Received on: 2020-02-01<p/> Found Near: 28100 MAPLE RIDGE WAY SE, MAPLE VALLEY WA 98038<p/> Description: Gray / White Spayed Female Domestic Mediumhair Cat<p/> Age: 6 YEARS<p/> Current Location: King County Pet Adoption Center 21615 64TH AVE S KENT, WA 98032<p/>",
K20-125002,A605872,Regional Animal Services of King County,LOST,https://petharbor.com/PublicDetail.asp?searchtype=PUBFOUND&view=sysadm.v_animal&shelterlist='KING'&where=type&ID=2078965,LOST,Robin,Cat,,Male,American Shorthair,Unknown,01/18/2020 12:00:00 AM,Date Lost,10830 SE 238TH ST,,,,JURISDICTION,,,https://petharbor.com/get_image.asp?RES=Detail&LOCATION=PUBLIC&ID=2078965,Image Copyright HLP Inc. 2020,,
K20-125058,A606066,Regional Animal Services of King County,FOUND,https://petharbor.com/pet.asp?uaid=KING.A606066,"Ranch S P Reber 28606 132ND AVE SE KENT, WA 98042",Tink,Cat,5 YEARS,Spayed Female,Domestic Shorthair,Brn Tabby / Tortie,01/24/2020 12:00:00 AM,Received on,28900 123RD WAY SE,AUBURN,WA,98092,KENT,,,https://petharbor.com/get_image.asp?RES=Detail&LOCATION=KING&ID=A606066,Image Copyright HLP Inc. 2020,"Received on: 2020-01-24<p/> Found Near: 28900 123RD WAY SE, AUBURN WA 98092<p/> Description: Brn Tabby / Tortie Spayed Female Domestic Shorthair Cat<p/> Age: 5 YEARS<p/> Current Location: Ranch S P Reber 28606 132ND AVE SE KENT, WA 98042<p/>",GREEN
K20-124915,A605469,Regional Animal Services of King County,LOST,https://petharbor.com/PublicDetail.asp?searchtype=PUBFOUND&view=sysadm.v_animal&shelterlist='KING'&where=type&ID=2077073,LOST,Cora,Dog,,Female,Miniature Poodle,Unknown,01/15/2020 12:00:00 AM,Date Lost,13360 56TH AVE SOUTH,,,,JURISDICTION,,,https://petharbor.com/get_image.asp?RES=Detail&LOCATION=PUBLIC&ID=2077073,Image Copyright HLP Inc. 2020,,
K20-125207,A606595,Regional Animal Services of King County,LOST,https://petharbor.com/PublicDetail.asp?searchtype=PUBFOUND&view=sysadm.v_animal&shelterlist='KING'&where=type&ID=2082242,LOST,Bruno,Dog,,Male,Beagle,Unknown,01/31/2020 12:00:00 AM,Date Lost,MERIDIAN JUNIOR HIGH SCHOOL,,,,JURISDICTION,,,https://petharbor.com/get_image.asp?RES=Detail&LOCATION=PUBLIC&ID=2082242,Image Copyright HLP Inc. 2020,,
K20-125187,A559116,Regional Animal Services of King County,ADOPTABLE,https://petharbor.com/pet.asp?uaid=KING.A559116,"King County Pet Adoption Center 21615 64TH AVE S KENT, WA 98032",Bear,Dog,9 YEARS 8 MONTHS,Neutered Male,Rottweiler / German Shepherd,Brown / Black,01/30/2020 12:00:00 AM,Received on,,,,,,,,https://petharbor.com/get_image.asp?RES=Detail&LOCATION=KING&ID=A559116,Image Copyright HLP Inc. 2020,"Received on: 2020-01-30<p/> Description: Brown / Black<p/>  Neutered Male Rottweiler / German Shepherd Dog<p/> Age: 9 YEARS 8 MONTHS<p/> Adoption Fee: $150.00<p/> Current Location: King County Pet Adoption Center 21615 64TH AVE S KENT, WA 98032<p/>Hi! My name is Bear and I am available for adoption.<p/><p/>I was brought in by my previous owner on January 30, 2020 because their family was growing too big for a large dog. I lived in a home with another dog and children. My previous did say that I can sometimes get annoyed with the children though due to my age and low activity level. My previous owner described me as as lazy and loyal.<p/><p/>I am a very smart dog! My previous owner stated that I know the commands sit, stay, go eat, up (jump), lay down, and slow down (for walks). I am also potty trained and crate trained.<p/><p/>I am an affectionate lovebug who would be thrilled to cuddle up with you at home! I love getting pets and will give you a ton of kisses if you let me!<p/><p/>My caregivers have noticed that I seem to be picky with my dog friends and prefer to not share my food with them. When meeting dogs in a new home, I would do best with a slow introduction. <p/><p/>Because of my older nature, I would do best in a home with older, respectful children.<p/><p/>My personality color is GREEN. I am an adaptable dog who loves to go with the flow! I am outgoing and carefree, and I just can't wait to find my forever home!<p/>",GREEN
K20-124745,A604757,Regional Animal Services of King County,LOST,https://petharbor.com/PublicDetail.asp?searchtype=PUBFOUND&view=sysadm.v_animal&shelterlist='KING'&where=type&ID=2073848,LOST,Ando,Cat,,Male,Siamese,Unknown,01/03/2020 12:00:00 AM,Date Lost,14513 254TH AVE. SE,,,,JURISDICTION,,,https://petharbor.com/get_image.asp?RES=Detail&LOCATION=PUBLIC&ID=2073848,Image Copyright HLP Inc. 2020,,
K20-124933,A605595,Regional Animal Services of King County,FOUND,https://petharbor.com/PublicDetail.asp?searchtype=PUBFOUND&view=sysadm.v_animal&shelterlist='KING'&where=type&ID=2077547,In Public Home,,Cat,,Female,Domestic Shorthair,White / Unknown,01/10/2020 12:00:00 AM,Date Found,PIKE AND 22ND STREET NE,,,,JURISDICTION,,,https://petharbor.com/get_image.asp?RES=Detail&LOCATION=PUBLIC&ID=2077547,Image Copyright HLP Inc. 2020,,
K20-124697,A604523,Regional Animal Services of King County,LOST,https://petharbor.com/PublicDetail.asp?searchtype=PUBFOUND&view=sysadm.v_animal&shelterlist='KING'&where=type&ID=2073061,LOST,Coco/simba,Dog,,Male,Chihuahua - Smooth Coated,Unknown,01/04/2020 12:00:00 AM,Date Lost,AIRPORT WAY SOUTH & INDUSRIAL WAY S,,,,JURISDICTION,,,https://petharbor.com/get_image.asp?RES=Detail&LOCATION=PUBLIC&ID=2073061,Image Copyright HLP Inc. 2020,,
K20-125117,A576926,Regional Animal Services of King County,ADOPTABLE,https://petharbor.com/pet.asp?uaid=KING.A576926,"Kirkland Petco 12040 NE 85TH ST KIRKLAND, WA 98033",Abu,Cat,1 YEAR 3 MONTHS,Neutered Male,Domestic Shorthair,Brn Tabby / White,01/26/2020 12:00:00 AM,Received on,12040 NE 85TH ST,KIRKLAND,WA,98033,KIRKLAND,47.680519,-122.179195,https://petharbor.com/get_image.asp?RES=Detail&LOCATION=KING&ID=A576926,Image Copyright HLP Inc. 2020,"Received on: 2020-01-26<p/> Description: Brn Tabby / White<p/>  Neutered Male Domestic Shorthair Cat<p/> Age: 1 YEAR 3 MONTHS<p/> Adoption Fee: $30.00<p/> Current Location: Kirkland Petco 12040 NE 85TH ST KIRKLAND, WA 98033<p/>Hi! My name is Abu and I am available for adoption.<p/><p/>I was brought in by a good samaritan on December 18th, 2018.<p/><p/>I'm a big ol' sweetie,I lived in a home with cats, adults and lots of children. I have not yet experiened a dog, so, I would prefer a slow transition. I'm also quite playful and would benefit going to a home with another cat or with another kitten friend. Take me home and teach me all the things I need to learn to be a big, confident kitty! <p/><p/>My personality color is GREEN. I am an adaptable cat who loves to go with the flow! I am outgoing and carefree, and I just can't wait to find my forever home!<p/><p/>",GREEN
K20-124726,A604645,Regional Animal Services of King County,LOST,https://petharbor.com/PublicDetail.asp?searchtype=PUBFOUND&view=sysadm.v_animal&shelterlist='KING'&where=type&ID=2073405,LOST,Nala,Dog,,Female,Pit Bull,Unknown,01/03/2020 12:00:00 AM,Date Lost,53RD AND AUGUSTA,,,,JURISDICTION,,,https://petharbor.com/get_image.asp?RES=Detail&LOCATION=PUBLIC&ID=2073405,Image Copyright HLP Inc. 2020,,
K20-124875,A605272,Regional Animal Services of King County,LOST,https://petharbor.com/PublicDetail.asp?searchtype=PUBFOUND&view=sysadm.v_animal&shelterlist='KING'&where=type&ID=2076408,LOST,Bandit,Dog,,Male,Labrador Retriever,Unknown,01/13/2020 12:00:00 AM,Date Lost,128TH PL SE AND 132ND AVE,,,,JURISDICTION,,,https://petharbor.com/get_image.asp?RES=Detail&LOCATION=PUBLIC&ID=2076408,Image Copyright HLP Inc. 2020,,
K20-125152,A606364,Regional Animal Services of King County,FOUND,https://petharbor.com/pet.asp?uaid=KING.A606364,"King County Pet Adoption Center 21615 64TH AVE S KENT, WA 98032",Integra,Dog,2 YEARS,Spayed Female,Pit Bull / Mix,Tan,01/28/2020 12:00:00 AM,Received on,,,,,SEATAC,,,https://petharbor.com/get_image.asp?RES=Detail&LOCATION=KING&ID=A606364,Image Copyright HLP Inc. 2020,"Received on: 2020-01-28<p/> Found Near: Address Not Available<p/> Description: Tan Spayed Female Pit Bull / Mix Dog<p/> Age: 2 YEARS<p/> Current Location: King County Pet Adoption Center 21615 64TH AVE S KENT, WA 98032<p/>",GREEN
K20-125175,A606483,Regional Animal Services of King County,LOST,https://petharbor.com/PublicDetail.asp?searchtype=PUBFOUND&view=sysadm.v_animal&shelterlist='KING'&where=type&ID=2081563,LOST,Jay,Cat,,Male,American Shorthair,Unknown,01/26/2020 12:00:00 AM,Date Lost,87TH AVE. S. & 116TH,,,,JURISDICTION,,,https://petharbor.com/get_image.asp?RES=Detail&LOCATION=PUBLIC&ID=2081563,Image Copyright HLP Inc. 2020,,
K20-124696,A604522,Regional Animal Services of King County,LOST,https://petharbor.com/PublicDetail.asp?searchtype=PUBFOUND&view=sysadm.v_animal&shelterlist='KING'&where=type&ID=2073058,LOST,Coco/simba,Dog,,Male,Chihuahua - Smooth Coated,Unknown,01/04/2020 12:00:00 AM,Date Lost,AIRPORT WAY SOUTH & INDUSRIAL WAY S,,,,JURISDICTION,,,https://petharbor.com/get_image.asp?RES=Detail&LOCATION=PUBLIC&ID=2073058,Image Copyright HLP Inc. 2020,,
K20-124999,A605869,Regional Animal Services of King County,FOUND,https://petharbor.com/pet.asp?uaid=KING.A605869,"King County Pet Adoption Center 21615 64TH AVE S KENT, WA 98032",Mack,Dog,NO AGE,Male,Labrador Retriever / Mix,Black / White,01/21/2020 12:00:00 AM,Received on,19600 142ND AVE SE,KENT,WA,98042,KING COUNTY,,,https://petharbor.com/get_image.asp?RES=Detail&LOCATION=KING&ID=A605869,Image Copyright HLP Inc. 2020,"Received on: 2020-01-21<p/> Found Near: 19600 142ND AVE SE, KENT WA 98042<p/> Description: Black / White Male Labrador Retriever / Mix Dog<p/> Age: NO AGE<p/> Current Location: King County Pet Adoption Center 21615 64TH AVE S KENT, WA 98032<p/>",
K20-124877,A605302,Regional Animal Services of King County,FOUND,https://petharbor.com/PublicDetail.asp?searchtype=PUBFOUND&view=sysadm.v_animal&shelterlist='KING'&where=type&ID=2076461,In Public Home,,Dog,,Female,Alaskan Husky,Black / White,01/14/2020 12:00:00 AM,Date Found,6850 NE BOTHELL WAY,,,,JURISDICTION,,,https://petharbor.com/get_image.asp?RES=Detail&LOCATION=PUBLIC&ID=2076461,Image Copyright HLP Inc. 2020,,
K20-124778,A604857,Regional Animal Services of King County,LOST,https://petharbor.com/PublicDetail.asp?searchtype=PUBFOUND&view=sysadm.v_animal&shelterlist='KING'&where=type&ID=2074443,LOST,Peanut,Cat,,Female,American Shorthair,Unknown,01/05/2020 12:00:00 AM,Date Lost,24TH AVE NE,RE,,,JURISDICTION,,,https://petharbor.com/get_image.asp?RES=Detail&LOCATION=PUBLIC&ID=2074443,Image Copyright HLP Inc. 2020,,
K20-125001,A605871,Regional Animal Services of King County,LOST,https://petharbor.com/PublicDetail.asp?searchtype=PUBFOUND&view=sysadm.v_animal&shelterlist='KING'&where=type&ID=2078964,LOST,Robin,Cat,,Male,American Shorthair,Unknown,01/18/2020 12:00:00 AM,Date Lost,APT 2H203,,,,JURISDICTION,,,https://petharbor.com/get_image.asp?RES=Detail&LOCATION=PUBLIC&ID=2078964,Image Copyright HLP Inc. 2020,,
K20-124734,A604714,Regional Animal Services of King County,LOST,https://petharbor.com/PublicDetail.asp?searchtype=PUBFOUND&view=sysadm.v_animal&shelterlist='KING'&where=type&ID=2073764,LOST,Coco,Dog,,Male,Standard Schnauzer,Unknown,01/05/2020 12:00:00 AM,Date Lost,SE MAY VALLEY RD,,,,JURISDICTION,,,https://petharbor.com/get_image.asp?RES=Detail&LOCATION=PUBLIC&ID=2073764,Image Copyright HLP Inc. 2020,,
K20-124973,A605741,Regional Animal Services of King County,LOST,https://petharbor.com/PublicDetail.asp?searchtype=PUBFOUND&view=sysadm.v_animal&shelterlist='KING'&where=type&ID=2078486,LOST,Nutmeg,Bird,,Male,Fowl,Unknown,01/20/2020 12:00:00 AM,Date Lost,APT 303,,,,JURISDICTION,,,https://petharbor.com/get_image.asp?RES=Detail&LOCATION=PUBLIC&ID=2078486,Image Copyright HLP Inc. 2020,,
K20-124777,A604856,Regional Animal Services of King County,FOUND,https://kingcounty.gov/depts/regional-animal-services/about-us/overview.aspx,,Ty,Dead Dog,NO AGE,Neutered Male,Doberman Pinscher / Mix,Black / Tan,01/08/2020 12:00:00 AM,Received on,6000 FOREST DR SE,BELLEVUE,WA,98006,BELLEVUE,47.548898,-122.156251,,Image Copyright HLP Inc. 2020,"Received on: 2020-01-08<p/> Found Near: 6000 FOREST DR SE, BELLEVUE, WA 98006<p/> Description: Black / Tan Neutered Male Doberman Pinscher / Mix Dog<p/> Age: NO AGE<p/>",
K20-125169,A606465,Regional Animal Services of King County,LOST,https://petharbor.com/PublicDetail.asp?searchtype=PUBFOUND&view=sysadm.v_animal&shelterlist='KING'&where=type&ID=2081437,LOST,Othello,Dog,,Male,American Pit Bull Terrier,Black / White,01/20/2020 12:00:00 AM,Date Lost,CENTRAL AVE AND WILLIS ST,,,,JURISDICTION,,,https://petharbor.com/get_image.asp?RES=Detail&LOCATION=PUBLIC&ID=2081437,Image Copyright HLP Inc. 2020,,
K20-125056,A606065,Regional Animal Services of King County,FOUND,https://petharbor.com/pet.asp?uaid=KING.A606065,"Covington Petco 27111 167TH PL SE COVINGTON, WA 98042",Sheena,Cat,2 YEARS,Spayed Female,Domestic Shorthair,Brn Tabby / Calico,01/24/2020 12:00:00 AM,Received on,18000 SE 224TH ST,KENT,WA,98042,KING COUNTY,,,https://petharbor.com/get_image.asp?RES=Detail&LOCATION=KING&ID=A606065,Image Copyright HLP Inc. 2020,"Received on: 2020-01-24<p/> Found Near: 18000 SE 224TH ST, KENT WA 98042<p/> Description: Brn Tabby / Calico Spayed Female Domestic Shorthair Cat<p/> Age: 2 YEARS<p/> Current Location: Covington Petco 27111 167TH PL SE COVINGTON, WA 98042<p/>",RED
K20-124698,A604524,Regional Animal Services of King County,LOST,https://petharbor.com/PublicDetail.asp?searchtype=PUBFOUND&view=sysadm.v_animal&shelterlist='KING'&where=type&ID=2073062,LOST,Coco/simba,Dog,,Male,Chihuahua - Smooth Coated,Unknown,01/04/2020 12:00:00 AM,Date Lost,AIRPORT WAY SOUTH & INDUSRIAL WAY S,,,,JURISDICTION,,,https://petharbor.com/get_image.asp?RES=Detail&LOCATION=PUBLIC&ID=2073062,Image Copyright HLP Inc. 2020,,
K20-124864,A605201,Regional Animal Services of King County,LOST,https://petharbor.com/PublicDetail.asp?searchtype=PUBFOUND&view=sysadm.v_animal&shelterlist='KING'&where=type&ID=2076112,LOST,Graeme,Cat,,Male,Domestic Shorthair,Unknown,01/12/2020 12:00:00 AM,Date Lost,84TH AND 138TH IN NE KING COUNTY,,,,JURISDICTION,,,https://petharbor.com/get_image.asp?RES=Detail&LOCATION=PUBLIC&ID=2076112,Image Copyright HLP Inc. 2020,,
K20-125242,A606661,Regional Animal Services of King County,FOUND,https://petharbor.com/pet.asp?uaid=KING.A606661,"King County Pet Adoption Center 21615 64TH AVE S KENT, WA 98032",,Cat,5 YEARS,Male,Domestic Shorthair,Gray / Black,02/03/2020 12:00:00 AM,Received on,21600 SE 400TH ST,ENUMCLAW,WA,98022,KING COUNTY,,,https://petharbor.com/get_image.asp?RES=Detail&LOCATION=KING&ID=A606661,Image Copyright HLP Inc. 2020,"Received on: 2020-02-03<p/> Found Near: 21600 SE 400TH ST, ENUMCLAW WA 98022<p/> Description: Gray / Black Male Domestic Shorthair Cat<p/> Age: 5 YEARS<p/> Current Location: King County Pet Adoption Center 21615 64TH AVE S KENT, WA 98032<p/>",
K20-125004,A605902,Regional Animal Services of King County,LOST,https://petharbor.com/PublicDetail.asp?searchtype=PUBFOUND&view=sysadm.v_animal&shelterlist='KING'&where=type&ID=2079076,LOST,Loki,Bird,,Male,Fowl,Unknown,01/14/2020 12:00:00 AM,Date Lost,60TH AVE W,NEAR MEADOWDALE BEACH,,,JURISDICTION,,,https://petharbor.com/get_image.asp?RES=Detail&LOCATION=PUBLIC&ID=2079076,Image Copyright HLP Inc. 2020,,
K20-124683,A071418,Regional Animal Services of King County,FOUND,https://petharbor.com/PublicDetail.asp?searchtype=PUBFOUND&view=sysadm.v_animal&shelterlist='KING'&where=type&ID=2072730,In Public Home,Mischief,Cat,,Neutered Male,Domestic Longhair,Black,01/03/2020 12:00:00 AM,Date Found,1640 E ISAACS AVE,,,,OTHER,,,https://petharbor.com/get_image.asp?RES=Detail&LOCATION=PUBLIC&ID=2072730,Image Copyright HLP Inc. 2020,,
K20-124730,A604648,Regional Animal Services of King County,FOUND,https://petharbor.com/PublicDetail.asp?searchtype=PUBFOUND&view=sysadm.v_animal&shelterlist='KING'&where=type&ID=2073484,In Public Home,,Dog,,Female,Havanese,Brown,01/05/2020 12:00:00 AM,Date Found,MILITARY ROAD AND S 240TH ST.,,,,JURISDICTION,,,https://petharbor.com/get_image.asp?RES=Detail&LOCATION=PUBLIC&ID=2073484,Image Copyright HLP Inc. 2020,,
K20-124736,A604720,Regional Animal Services of King County,LOST,https://petharbor.com/PublicDetail.asp?searchtype=PUBFOUND&view=sysadm.v_animal&shelterlist='KING'&where=type&ID=2073785,LOST,Roser,Cat,,Male,Domestic Mediumhair,Unknown,12/30/2019 12:00:00 AM,Date Lost,HWY 203,,,,JURISDICTION,,,https://petharbor.com/get_image.asp?RES=Detail&LOCATION=PUBLIC&ID=2073785,Image Copyright HLP Inc. 2020,,
K20-125157,A083917,Regional Animal Services of King County,FOUND,https://kingcounty.gov/depts/regional-animal-services/about-us/overview.aspx,,Chester,Dead Cat,8 YEARS 10 MONTHS,Neutered Male,Domestic Shorthair,Org Tabby / White,01/28/2020 12:00:00 AM,Received on,28500 161ST PL SE,COVINGTON,WA,98042,COVINGTON,,,,Image Copyright HLP Inc. 2020,"Received on: 2020-01-28<p/> Found Near: 28500 161ST PL SE, COVINGTON WA 98042<p/> Description: Org Tabby / White Neutered Male Domestic Shorthair Cat<p/> Age: 8 YEARS 10 MONTHS<p/>",
K20-125078,A606111,Regional Animal Services of King County,LOST,https://petharbor.com/PublicDetail.asp?searchtype=PUBFOUND&view=sysadm.v_animal&shelterlist='KING'&where=type&ID=2080096,LOST,Kitty Guy,Cat,,Male,Bengal,Unknown,01/22/2020 12:00:00 AM,Date Lost,4635 S 255TH STREET,,,,JURISDICTION,,,https://petharbor.com/get_image.asp?RES=Detail&LOCATION=PUBLIC&ID=2080096,Image Copyright HLP Inc. 2020,,
K20-125180,A606488,Regional Animal Services of King County,LOST,https://petharbor.com/PublicDetail.asp?searchtype=PUBFOUND&view=sysadm.v_animal&shelterlist='KING'&where=type&ID=2081669,LOST,Gabby,Cat,,Male,Norwegian Forest Cat,Unknown,01/26/2020 12:00:00 AM,Date Lost,213TH AND 196TH AVE SE,,,,JURISDICTION,,,https://petharbor.com/get_image.asp?RES=Detail&LOCATION=PUBLIC&ID=2081669,Image Copyright HLP Inc. 2020,,
K20-125225,A606619,Regional Animal Services of King County,FOUND,https://petharbor.com/pet.asp?uaid=KING.A606619,"King County Pet Adoption Center 21615 64TH AVE S KENT, WA 98032",Titan,Dog,4 YEARS 2 MONTHS,Male,Wolf Hybrid,Sable / White,02/01/2020 12:00:00 AM,Received on,12200 SE 192ND ST,KENT,WA,98031,KENT,,,https://petharbor.com/get_image.asp?RES=Detail&LOCATION=KING&ID=A606619,Image Copyright HLP Inc. 2020,"Received on: 2020-02-01<p/> Found Near: 12200 SE 192ND ST, KENT WA 98031<p/> Description: Sable / White Male Wolf Hybrid Dog<p/> Age: 4 YEARS 2 MONTHS<p/> Current Location: King County Pet Adoption Center 21615 64TH AVE S KENT, WA 98032<p/>",
K20-125208,A603717,Regional Animal Services of King County,FOUND,https://petharbor.com/pet.asp?uaid=KING.A603717,"King County Pet Adoption Center 21615 64TH AVE S KENT, WA 98032",Dakota,Dog,3 YEARS 1 MONTH,Spayed Female,German Shepherd / Alaskan Husky,Brown / Black,01/31/2020 12:00:00 AM,Received on,39600 AUBURN ENUMCLAW RD SE,AUBURN,WA,98092,KING COUNTY,,,https://petharbor.com/get_image.asp?RES=Detail&LOCATION=KING&ID=A603717,Image Copyright HLP Inc. 2020,"Received on: 2020-01-31<p/> Found Near: 39600 AUBURN ENUMCLAW RD SE, AUBURN WA 98092<p/> Description: Brown / Black Spayed Female German Shepherd / Alaskan Husky Dog<p/> Age: 3 YEARS 1 MONTH<p/> Current Location: King County Pet Adoption Center 21615 64TH AVE S KENT, WA 98032<p/>",
K20-125096,A606150,Regional Animal Services of King County,LOST,https://petharbor.com/PublicDetail.asp?searchtype=PUBFOUND&view=sysadm.v_animal&shelterlist='KING'&where=type&ID=2080420,LOST,Hazel,Dog,,Female,Australian Shepherd,Unknown,01/25/2020 12:00:00 AM,Date Lost,15108 SE 179TH APT 3D,,,,JURISDICTION,,,https://petharbor.com/get_image.asp?RES=Detail&LOCATION=PUBLIC&ID=2080420,Image Copyright HLP Inc. 2020,,
K20-124861,A605162,Regional Animal Services of King County,LOST,https://petharbor.com/PublicDetail.asp?searchtype=PUBFOUND&view=sysadm.v_animal&shelterlist='KING'&where=type&ID=2075973,LOST,Lemon,Cat,,Male,Savannah,Unknown,01/10/2020 12:00:00 AM,Date Lost,,,,502,JURISDICTION,,,https://petharbor.com/get_image.asp?RES=Detail&LOCATION=PUBLIC&ID=2075973,Image Copyright HLP Inc. 2020,,
K20-125190,A606544,Regional Animal Services of King County,ADOPTABLE,https://petharbor.com/pet.asp?uaid=KING.A606544,"Kirkland Petco 12040 NE 85TH ST KIRKLAND, WA 98033",Willy,Cat,10 YEARS,Neutered Male,Domestic Longhair,Brn Tabby,01/30/2020 12:00:00 AM,Received on,12040 NE 85TH ST,KIRKLAND,WA,98033,KIRKLAND,47.680519,-122.179195,https://petharbor.com/get_image.asp?RES=Detail&LOCATION=KING&ID=A606544,Image Copyright HLP Inc. 2020,"Received on: 2020-01-30<p/> Description: Brn Tabby<p/>  Neutered Male Domestic Longhair Cat<p/> Age: 10 YEARS<p/> Adoption Fee: $30.00<p/> Current Location: Kirkland Petco 12040 NE 85TH ST KIRKLAND, WA 98033<p/>Hi! My name is Willy and I am available for adoption.<p/><p/>I was brought in by my previous owner on January 30, 2020 because previous owner passed away. I lived in a home with 2 other cats, and a young child. My previous owner described me as friendly and outgoing. <p/><p/>I am a very affectionate cat with so much love to give.  I'm a shadow cat, meaning that I'm always trying to follow my humans around!  I have been inside and outside and I would love to live in a house with a yard that I can hang out in!<p/><p/>My personality color is GREEN. I am an adaptable cat who loves to go with the flow! I am outgoing and carefree, and I just can't wait to find my forever home!<p/><p/><p/>",GREEN
K20-124876,A605300,Regional Animal Services of King County,FOUND,https://petharbor.com/PublicDetail.asp?searchtype=PUBFOUND&view=sysadm.v_animal&shelterlist='KING'&where=type&ID=2076454,In Public Home,,Dog,,Male,Alaskan Husky,White,01/14/2020 12:00:00 AM,Date Found,6850 NE BOTHELL WAY,,,,JURISDICTION,,,https://petharbor.com/get_image.asp?RES=Detail&LOCATION=PUBLIC&ID=2076454,Image Copyright HLP Inc. 2020,,
K18-114474,A577312,Regional Animal Services of King County,ADOPTABLE,https://kingcounty.gov/depts/regional-animal-services/about-us/overview.aspx,In RASKC Foster Home,Pepper,Cat,7 YEARS 1 MONTH,Spayed Female,Domestic Shorthair,Black,12/21/2018 12:00:00 AM,Received on,21615 64TH AVE S,KENT,WA,98032,KING COUNTY,47.407788,-122.255197,https://petharbor.com/get_image.asp?RES=Detail&LOCATION=KING&ID=A577312,Image Copyright HLP Inc. 2020,"Received on: 2018-12-21<p/> Description: Black Spayed Female Domestic Shorthair Cat<p/> Age: 7 YEARS 1 MONTH<p/> Adoption Fee: $30.00<p/> Current Location: In RASKC Foster Home <p/>Hi! My name is Pepper and I am available for adoption.<p/><p/>I was brought in by a good samaritan on December 21, 2018.<p/><p/>I am an independent kitty who likes to do my own thing!<p/><p/>My caregivers have noticed that I seem to do well with other cats. When meeting cats in a new home, I would do best with a slow introduction.<p/><p/>Because of my shy nature, I would do best in a calm, quiet home.<p/><p/>My personality color is BLUE. I am a gentle and loving cat who likes to take things slow. I may get nervous in new situations, so I am looking for a family who understands that I might need some time to warm up. Once I get to know you, I will be a very devoted friend!<p/><p/><p/>",BLUE
K20-124989,A605821,Regional Animal Services of King County,FOUND,https://kingcounty.gov/depts/regional-animal-services/about-us/overview.aspx,,,Dead Dog,NO AGE,Female,Terrier / Mix,Tan,01/21/2020 12:00:00 AM,Received on,25800 LAKE FENWICK RD S,KENT,WA,98032,KENT,,,,Image Copyright HLP Inc. 2020,"Received on: 2020-01-21<p/> Found Near: 25800 LAKE FENWICK RD S, KENT WA 98032<p/> Description: Tan Female Terrier / Mix Dog<p/> Age: NO AGE<p/>",
K19-124530,A603943,Regional Animal Services of King County,LOST,https://petharbor.com/PublicDetail.asp?searchtype=PUBFOUND&view=sysadm.v_animal&shelterlist='KING'&where=type&ID=2069391,LOST,Princess,Cat,,Female,American Shorthair,Unknown,12/25/2019 12:00:00 AM,Date Lost,119 19TH AVE E APT 105,,,,JURISDICTION,,,https://petharbor.com/get_image.asp?RES=Detail&LOCATION=PUBLIC&ID=2069391,Image Copyright HLP Inc. 2020,,
K20-124685,A604511,Regional Animal Services of King County,LOST,https://petharbor.com/PublicDetail.asp?searchtype=PUBFOUND&view=sysadm.v_animal&shelterlist='KING'&where=type&ID=2072787,LOST,Whisky,Cat,,Female,Domestic Shorthair,Unknown,12/31/2019 12:00:00 AM,Date Lost,NORTH 178TH STREET AND 1ST AVE.,,,,JURISDICTION,,,https://petharbor.com/get_image.asp?RES=Detail&LOCATION=PUBLIC&ID=2072787,Image Copyright HLP Inc. 2020,,
K19-122788,A598970,Regional Animal Services of King County,ADOPTABLE,https://kingcounty.gov/depts/regional-animal-services/about-us/overview.aspx,In RASKC Foster Home,Ms Jazz,Cat,12 YEARS 3 MONTHS,Spayed Female,Domestic Shorthair,Brn Tabby / White,10/18/2019 12:00:00 AM,Received on,21615 64TH AVE S,KENT,WA,98032,SEATTLE,47.407788,-122.255197,https://petharbor.com/get_image.asp?RES=Detail&LOCATION=KING&ID=A598970,Image Copyright HLP Inc. 2020,"Received on: 2019-10-18<p/> Description: Brn Tabby / White Spayed Female Domestic Shorthair Cat<p/> Age: 12 YEARS 3 MONTHS<p/> Adoption Fee: $30.00<p/> Current Location: In RASKC Foster Home <p/>Hi! My name is Ms Jazz and I am available for adoption.<p/><p/>I was brought in on October 18, 2019 because my previous owner passed away.<p/><p/>I am an affectionate lovebug who likes getting attention on my own terms. I can get overstimulated with petting, so please move carefully with me and keep an eye out for signs that I might need a break.<p/><p/>I was previously declawed on all four paws. Because I can't protect myself outside, I need to be an indoor-only cat.<p/><p/>Because of my older age, I would do best in a calm, quiet home with respectful children<p/><p/>My personality color is RED. I am a spirited cat with a fun-loving personality! I may be sensitive to handling, so I would do best in a home with a cat savvy family who knows when to give me some space.<p/>",GREEN
K20-124972,A605738,Regional Animal Services of King County,LOST,https://petharbor.com/PublicDetail.asp?searchtype=PUBFOUND&view=sysadm.v_animal&shelterlist='KING'&where=type&ID=2078395,LOST,Abby,Dog,,Female,Chihuahua - Smooth Coated,Unknown,01/18/2020 12:00:00 AM,Date Lost,APT 425,,,,JURISDICTION,,,https://petharbor.com/get_image.asp?RES=Detail&LOCATION=PUBLIC&ID=2078395,Image Copyright HLP Inc. 2020,,
K20-125108,A606159,Regional Animal Services of King County,LOST,https://petharbor.com/PublicDetail.asp?searchtype=PUBFOUND&view=sysadm.v_animal&shelterlist='KING'&where=type&ID=2080510,LOST,Ally,Cat,,Female,Domestic Longhair,Unknown,01/23/2020 12:00:00 AM,Date Lost,27207 SE 188TH ST,,,,JURISDICTION,,,https://petharbor.com/get_image.asp?RES=Detail&LOCATION=PUBLIC&ID=2080510,Image Copyright HLP Inc. 2020,,
K20-125177,A606485,Regional Animal Services of King County,FOUND,https://petharbor.com/pet.asp?uaid=KING.A606485,"King County Pet Adoption Center 21615 64TH AVE S KENT, WA 98032",Seras,Dog,8 MONTHS,Female,Boxer / Mix,Br Brindle / White,01/29/2020 12:00:00 AM,Received on,18600 SE 128TH ST,RENTON,WA,98059,KING COUNTY,,,https://petharbor.com/get_image.asp?RES=Detail&LOCATION=KING&ID=A606485,Image Copyright HLP Inc. 2020,"Received on: 2020-01-29<p/> Found Near: 18600 SE 128TH ST, RENTON WA 98059<p/> Description: Br Brindle / White Female Boxer / Mix Dog<p/> Age: 8 MONTHS<p/> Current Location: King County Pet Adoption Center 21615 64TH AVE S KENT, WA 98032<p/>",BLUE
K20-125251,A606684,Regional Animal Services of King County,FOUND,https://petharbor.com/pet.asp?uaid=KING.A606684,"King County Pet Adoption Center 21615 64TH AVE S KENT, WA 98032",,Dog,2 YEARS,Neutered Male,Siberian Husky,Red / White,02/03/2020 12:00:00 AM,Received on,8500 S 121ST ST,SEATTLE,WA,98178,KING COUNTY,,,https://petharbor.com/get_image.asp?RES=Detail&LOCATION=KING&ID=A606684,Image Copyright HLP Inc. 2020,"Received on: 2020-02-03<p/> Found Near: 8500 S 121ST ST, SEATTLE WA 98178<p/> Description: Red / White Neutered Male Siberian Husky Dog<p/> Age: 2 YEARS<p/> Current Location: King County Pet Adoption Center 21615 64TH AVE S KENT, WA 98032<p/>",
K20-124929,A605584,Regional Animal Services of King County,ADOPTABLE,https://petharbor.com/pet.asp?uaid=KING.A605584,"King County Pet Adoption Center 21615 64TH AVE S KENT, WA 98032",T Bone,Dog,8 YEARS,Neutered Male,Boxer / Chow Chow,Red / White,01/17/2020 12:00:00 AM,Received on,,,,,,,,https://petharbor.com/get_image.asp?RES=Detail&LOCATION=KING&ID=A605584,Image Copyright HLP Inc. 2020,"Received on: 2020-01-17<p/> Description: Red / White<p/>  Neutered Male Boxer / Chow Chow Dog<p/> Age: 8 YEARS<p/> Adoption Fee: $100.00<p/> Current Location: King County Pet Adoption Center 21615 64TH AVE S KENT, WA 98032<p/>Hi! My name is T Bone and I am available for adoption.<p/><p/>I was brought in by a good samaritan on January 17, 2020.<p/><p/>I am an independent dog who likes to do my own thing! <p/><p/>I am an affectionate lovebug who would be thrilled to cuddle up with you at home!<p/><p/>My caregivers have noticed that I seem to do well with other dogs. When meeting dogs in a new home, I would do best with a slow introduction.<p/><p/>I would do best in a home with older children because I don't always like to share things.<p/><p/>My personality color is RED. I am a spirited dog with a fun-loving personality! I am still working on my manners, so I would do best with a family who is willing to work with me and help me become the best dog I can be!<p/><p/>",RED
K20-125240,A606655,Regional Animal Services of King County,FOUND,https://petharbor.com/PublicDetail.asp?searchtype=PUBFOUND&view=sysadm.v_animal&shelterlist='KING'&where=type&ID=2083032,In Public Home,,Dog,Unknown,Female,Chihuahua - Smooth Coated,White,02/01/2020 12:00:00 AM,Date Found,160TH ST. AND 193RD AVE SE,,,,JURISDICTION,,,https://petharbor.com/get_image.asp?RES=Detail&LOCATION=PUBLIC&ID=2083032,Image Copyright HLP Inc. 2020,Description: We Found the dog running in the street.  We were afraid she would get hit by a car. She was really scared and afraid.<p/>Age: Unknown<p/>Location Found: 160th St. and 193rd Ave SE<p/>Notes: <p/>Found Date: 02/01/2020<p/>Finder Address:  Renton WA 98058,
K20-125000,A605870,Regional Animal Services of King County,LOST,https://petharbor.com/PublicDetail.asp?searchtype=PUBFOUND&view=sysadm.v_animal&shelterlist='KING'&where=type&ID=2078948,LOST,Wanda,Cat,,Female,American Shorthair,Unknown,01/20/2020 12:00:00 AM,Date Lost,25400 120TH PLACE SE,KENT,WA,98030,JURISDICTION,,,https://petharbor.com/get_image.asp?RES=Detail&LOCATION=PUBLIC&ID=2078948,Image Copyright HLP Inc. 2020,,
K20-125159,A574929,Regional Animal Services of King County,ADOPTABLE,https://petharbor.com/pet.asp?uaid=KING.A574929,"King County Pet Adoption Center 21615 64TH AVE S KENT, WA 98032",Georgie,Cat,9 YEARS 2 MONTHS,Spayed Female,Domestic Shorthair,Brn Tabby / White,01/28/2020 12:00:00 AM,Received on,,,,,,,,https://petharbor.com/get_image.asp?RES=Detail&LOCATION=KING&ID=A574929,Image Copyright HLP Inc. 2020,"Received on: 2020-01-28<p/> Description: Brn Tabby / White<p/>  Spayed Female Domestic Shorthair Cat<p/> Age: 9 YEARS 2 MONTHS<p/> Adoption Fee: $30.00<p/> Current Location: King County Pet Adoption Center 21615 64TH AVE S KENT, WA 98032<p/>[EXTERNAL Email Notice! ] External communication is important to us. Be cautious of phishing attempts. Do not click or open suspicious links or attachments.<p/><p/>Hi! My name is Georgie. I'm a 9 year old spayed female domestic short hair tabby cat. I used to live in a home with another cat and a dog. I also lived with kids, but I wasn't a good fit there. Having said that, I'm a little shy with kids and other cats, and would prefer to be your one and only kitty. I could live with another cat as long as I could eat separately from them. Please choose me!<p/>",GREEN
K20-125065,A606083,Regional Animal Services of King County,ADOPTABLE,https://petharbor.com/pet.asp?uaid=KING.A606083,"Kirkland Petco 12040 NE 85TH ST KIRKLAND, WA 98033",Miley,Cat,3 YEARS 7 MONTHS,Spayed Female,Domestic Shorthair,Black,01/24/2020 12:00:00 AM,Received on,12040 NE 85TH ST,KIRKLAND,WA,98033,KIRKLAND,47.680519,-122.179195,https://petharbor.com/get_image.asp?RES=Detail&LOCATION=KING&ID=A606083,Image Copyright HLP Inc. 2020,"Received on: 2020-01-24<p/> Description: Black<p/>  Spayed Female Domestic Shorthair Cat<p/> Age: 3 YEARS 7 MONTHS<p/> Adoption Fee: $30.00<p/> Current Location: Kirkland Petco 12040 NE 85TH ST KIRKLAND, WA 98033<p/>Hi! My name is Miley and I am available for adoption.<p/><p/>I was brought in by an Animal Control Officer on January 24th because my owner had passed away.<p/><p/>I am quite shy at first, but once we become friends, I can be very snuggly. I like getting attention on my own terms. I can get overstimulated with petting, so please move carefully with me and keep an eye out for signs that I might need a break. My caregivers have noticed that I seem to do well with other cats. When meeting cats in a new home, I would do best with a slow introduction.<p/><p/>My personality color is RED. I am a spirited cat with a fun-loving personality! I may be sensitive to handling, so I would do best in a home with a cat savvy family who knows when to give me some space.<p/>",RED
K20-124701,A604625,Regional Animal Services of King County,FOUND,https://petharbor.com/PublicDetail.asp?searchtype=PUBFOUND&view=sysadm.v_animal&shelterlist='KING'&where=type&ID=2073244,In Public Home,,Cat,,Male,Siamese,White / Brown,01/02/2020 12:00:00 AM,Date Found,6TH STREET,,,,JURISDICTION,,,https://petharbor.com/get_image.asp?RES=Detail&LOCATION=PUBLIC&ID=2073244,Image Copyright HLP Inc. 2020,,
K19-124522,A603928,Regional Animal Services of King County,LOST,https://petharbor.com/PublicDetail.asp?searchtype=PUBFOUND&view=sysadm.v_animal&shelterlist='KING'&where=type&ID=2069254,LOST,Jango,Cat,,Male,Domestic Shorthair,Unknown,12/22/2019 12:00:00 AM,Date Lost,214TH PL SE,,,,JURISDICTION,,,https://petharbor.com/get_image.asp?RES=Detail&LOCATION=PUBLIC&ID=2069254,Image Copyright HLP Inc. 2020,,
K20-124700,A604624,Regional Animal Services of King County,LOST,https://petharbor.com/PublicDetail.asp?searchtype=PUBFOUND&view=sysadm.v_animal&shelterlist='KING'&where=type&ID=2073213,LOST,Milly,Cat,,Female,Russian Blue,Unknown,12/31/2019 12:00:00 AM,Date Lost,PACIFIC HIWAY AND 260TH SHOPPING CENTER,,,,JURISDICTION,,,https://petharbor.com/get_image.asp?RES=Detail&LOCATION=PUBLIC&ID=2073213,Image Copyright HLP Inc. 2020,,
K19-124614,A604190,Regional Animal Services of King County,LOST,https://petharbor.com/PublicDetail.asp?searchtype=PUBFOUND&view=sysadm.v_animal&shelterlist='KING'&where=type&ID=2071105,LOST,Buddy,Cat,,Male,Domestic Shorthair,Unknown,12/30/2019 12:00:00 AM,Date Lost,F104,,,,JURISDICTION,,,https://petharbor.com/get_image.asp?RES=Detail&LOCATION=PUBLIC&ID=2071105,Image Copyright HLP Inc. 2020,,
K20-125203,A606591,Regional Animal Services of King County,FOUND,https://petharbor.com/pet.asp?uaid=KING.A606591,"King County Pet Adoption Center 21615 64TH AVE S KENT, WA 98032",Catlypso,Cat,1 YEAR,Female,Domestic Shorthair,White / Brn Tabby,01/31/2020 12:00:00 AM,Received on,7000 S 182ND ST,KENT,WA,98032,KENT,,,https://petharbor.com/get_image.asp?RES=Detail&LOCATION=KING&ID=A606591,Image Copyright HLP Inc. 2020,"Received on: 2020-01-31<p/> Found Near: 7000 S 182ND ST, KENT WA 98032<p/> Description: White / Brn Tabby Female Domestic Shorthair Cat<p/> Age: 1 YEAR<p/> Current Location: King County Pet Adoption Center 21615 64TH AVE S KENT, WA 98032<p/>",
K20-125011,A605939,Regional Animal Services of King County,LOST,https://petharbor.com/PublicDetail.asp?searchtype=PUBFOUND&view=sysadm.v_animal&shelterlist='KING'&where=type&ID=2079217,LOST,Chesa,Dog,,Female,Alaskan Husky,Unknown,01/20/2020 12:00:00 AM,Date Lost,NE 88TH & LATONA AVE NE,,,,JURISDICTION,,,https://petharbor.com/get_image.asp?RES=Detail&LOCATION=PUBLIC&ID=2079217,Image Copyright HLP Inc. 2020,,
K20-125234,A606640,Regional Animal Services of King County,FOUND,https://petharbor.com/pet.asp?uaid=KING.A606640,"King County Pet Adoption Center 21615 64TH AVE S KENT, WA 98032",,Lop-Holland,NO AGE,Male,Lop-Holland,Calico,02/02/2020 12:00:00 AM,Received on,21600 46TH PL S,KENT,WA,98032,KENT,,,https://petharbor.com/get_image.asp?RES=Detail&LOCATION=KING&ID=A606640,Image Copyright HLP Inc. 2020,"Received on: 2020-02-02<p/> Found Near: 21600 46TH PL S, KENT WA 98032<p/> Description: Calico Male Lop-Holland Lop-Holland<p/> Age: NO AGE<p/> Current Location: King County Pet Adoption Center 21615 64TH AVE S KENT, WA 98032<p/>",
K20-125020,A605944,Regional Animal Services of King County,FOUND,https://kingcounty.gov/depts/regional-animal-services/about-us/overview.aspx,In RASKC Foster Home,,Cat,1 WEEK,Unaltered,Domestic Shorthair,Brn Tabby / White,01/21/2020 12:00:00 AM,Received on,400 W CLOUDY ST,KENT,WA,98032,KENT,,,https://petharbor.com/get_image.asp?RES=Detail&LOCATION=KING&ID=A605944,Image Copyright HLP Inc. 2020,"Received on: 2020-01-21<p/> Found Near: 400 W CLOUDY ST, KENT WA 98032<p/> Description: Brn Tabby / White Unaltered Domestic Shorthair Cat<p/> Age: 1 WEEK<p/> Current Location: In RASKC Foster Home <p/>",
K19-123486,A600637,Regional Animal Services of King County,ADOPTABLE,https://kingcounty.gov/depts/regional-animal-services/about-us/overview.aspx,In RASKC Foster Home,Kuni,Cat,7 MONTHS,Neutered Male,Domestic Shorthair,Brn Tabby,11/12/2019 12:00:00 AM,Received on,21615 64TH AVE S,KENT,WA,98032,KING COUNTY,47.407788,-122.255197,https://petharbor.com/get_image.asp?RES=Detail&LOCATION=KING&ID=A600637,Image Copyright HLP Inc. 2020,"Received on: 2019-11-12<p/> Description: Brn Tabby Neutered Male Domestic Shorthair Cat<p/> Age: 7 MONTHS<p/> Adoption Fee: $100.00<p/> Current Location: In RASKC Foster Home <p/>I am currently in foster care working on my courage. I am still very shy. <p/>My fosters have noticed I do really well with any cat. I really need a home with a confident cat to help me with my courage.<p/>I would do best with a cat savvy family without children.<p/>I do my best on my foster mom's bed. There I love to be pet and purr. I can be a really snuggle buddy. <p/>I have started coming up to find out what you are eating, and steal if the food if I am allowed. <p/>I do run away from everyone, until I jump on the bed. <p/>I do OK with being held. But not a big fan of it (yet). <p/>I love toys and will chase the laser. I like to jump after high flying toys. (Sometimes I do backflips). <p/><p/>Please reach out my foster parent (Karen) at 253-381-6137. (they work so a text message would be the best), so you can come meet me.<p/>",BLUE
K20-125005,A605903,Regional Animal Services of King County,FOUND,https://kingcounty.gov/depts/regional-animal-services/about-us/overview.aspx,In RASKC Foster Home,,Cat,1 WEEK,Unaltered,Domestic Shorthair,Brn Tabby / White,01/21/2020 12:00:00 AM,Received on,400 W CLOUDY ST,KENT,WA,98032,KENT,,,https://petharbor.com/get_image.asp?RES=Detail&LOCATION=KING&ID=A605903,Image Copyright HLP Inc. 2020,"Received on: 2020-01-21<p/> Found Near: 400 W CLOUDY ST, KENT WA 98032<p/> Description: Brn Tabby / White Unaltered Domestic Shorthair Cat<p/> Age: 1 WEEK<p/> Current Location: In RASKC Foster Home <p/>",
K20-124669,A604449,Regional Animal Services of King County,LOST,https://petharbor.com/PublicDetail.asp?searchtype=PUBFOUND&view=sysadm.v_animal&shelterlist='KING'&where=type&ID=2072612,LOST,Shilo,Dog,,Male,Siberian Husky,Unknown,01/03/2020 12:00:00 AM,Date Lost,KENT DES MOINES RD AND PACIFIC HWY,,,,JURISDICTION,,,https://petharbor.com/get_image.asp?RES=Detail&LOCATION=PUBLIC&ID=2072612,Image Copyright HLP Inc. 2020,,
K20-124950,A605663,Regional Animal Services of King County,FOUND,https://kingcounty.gov/depts/regional-animal-services/about-us/overview.aspx,,,Dead Cat,NO AGE,Male,Domestic Longhair,Black / White,01/18/2020 12:00:00 AM,Received on,30300 KENT-BLACK DIAMOND RD SE,KENT,WA,98042,KING COUNTY,,,,Image Copyright HLP Inc. 2020,"Received on: 2020-01-18<p/> Found Near: 30300 KENT-BLACK DIAMOND RD SE, KENT WA 98042<p/> Description: Black / White Male Domestic Longhair Cat<p/> Age: NO AGE<p/>",
K20-125009,A605937,Regional Animal Services of King County,FOUND,https://kingcounty.gov/depts/regional-animal-services/about-us/overview.aspx,In RASKC Foster Home,,Cat,1 WEEK,Unaltered,Domestic Shorthair,Black / White,01/21/2020 12:00:00 AM,Received on,400 W CLOUDY ST,KENT,WA,98032,KENT,,,https://petharbor.com/get_image.asp?RES=Detail&LOCATION=KING&ID=A605937,Image Copyright HLP Inc. 2020,"Received on: 2020-01-21<p/> Found Near: 400 W CLOUDY ST, KENT WA 98032<p/> Description: Black / White Unaltered Domestic Shorthair Cat<p/> Age: 1 WEEK<p/> Current Location: In RASKC Foster Home <p/>",
K19-124613,A604189,Regional Animal Services of King County,FOUND,https://petharbor.com/pet.asp?uaid=KING.A604189,"King County Pet Adoption Center 21615 64TH AVE S KENT, WA 98032",Trap,Dog,1 YEAR 5 MONTHS,Male,Pit Bull / Akita,Black / White,12/30/2019 12:00:00 AM,Received on,5700 S 130TH PL,SEATTLE,WA,98178,TUKWILA,,,https://petharbor.com/get_image.asp?RES=Detail&LOCATION=KING&ID=A604189,Image Copyright HLP Inc. 2020,"Received on: 2019-12-30<p/> Found Near: 5700 S 130TH PL, SEATTLE WA 98178<p/> Description: Black / White Male Pit Bull / Akita Dog<p/> Age: 1 YEAR 5 MONTHS<p/> Current Location: King County Pet Adoption Center 21615 64TH AVE S KENT, WA 98032<p/>",RED
K20-125074,A606107,Regional Animal Services of King County,FOUND,https://petharbor.com/pet.asp?uaid=KING.A606107,"King County Pet Adoption Center 21615 64TH AVE S KENT, WA 98032",,Cat,1 YEAR,Neutered Male,Domestic Shorthair,Brn Tabby,01/24/2020 12:00:00 AM,Received on,ROOSEVELT AVE,ENUMCLAW,WA,98022,ENUMCLAW,,,https://petharbor.com/get_image.asp?RES=Detail&LOCATION=KING&ID=A606107,Image Copyright HLP Inc. 2020,"Received on: 2020-01-24<p/> Found Near: ROOSEVELT AVE, ENUMCLAW WA 98022<p/> Description: Brn Tabby Neutered Male Domestic Shorthair Cat<p/> Age: 1 YEAR<p/> Current Location: King County Pet Adoption Center 21615 64TH AVE S KENT, WA 98032<p/>",
K20-124882,A605361,Regional Animal Services of King County,FOUND,https://petharbor.com/pet.asp?uaid=KING.A605361,"King County Pet Adoption Center 21615 64TH AVE S KENT, WA 98032",Robyn,Cat,2 YEARS,Spayed Female,Domestic Shorthair,Calico / White,01/14/2020 12:00:00 AM,Received on,3100 HUNTER CT,ENUMCLAW,WA,98022,ENUMCLAW,,,https://petharbor.com/get_image.asp?RES=Detail&LOCATION=KING&ID=A605361,Image Copyright HLP Inc. 2020,"Received on: 2020-01-14<p/> Found Near: 3100 HUNTER CT, ENUMCLAW WA 98022<p/> Description: Calico / White Spayed Female Domestic Shorthair Cat<p/> Age: 2 YEARS<p/> Current Location: King County Pet Adoption Center 21615 64TH AVE S KENT, WA 98032<p/>",BLUE
K20-125226,A606620,Regional Animal Services of King County,LOST,https://petharbor.com/PublicDetail.asp?searchtype=PUBFOUND&view=sysadm.v_animal&shelterlist='KING'&where=type&ID=2082653,LOST,Audrey My Jo,Dog,,Female,Standard Poodle,Unknown,01/29/2020 12:00:00 AM,Date Lost,00 LAKE BELLEVUE DR,BELLEVUE,WA,98005,JURISDICTION,,,https://petharbor.com/get_image.asp?RES=Detail&LOCATION=PUBLIC&ID=2082653,Image Copyright HLP Inc. 2020,,
K20-124971,A605714,Regional Animal Services of King County,LOST,https://petharbor.com/PublicDetail.asp?searchtype=PUBFOUND&view=sysadm.v_animal&shelterlist='KING'&where=type&ID=2078309,LOST,Pampushka,Cat,,Female,Domestic Mediumhair,Unknown,01/15/2020 12:00:00 AM,Date Lost,SW 327TH PLACE AND 51ST PL SW,,,,JURISDICTION,,,https://petharbor.com/get_image.asp?RES=Detail&LOCATION=PUBLIC&ID=2078309,Image Copyright HLP Inc. 2020,,
K20-125006,A605904,Regional Animal Services of King County,FOUND,https://kingcounty.gov/depts/regional-animal-services/about-us/overview.aspx,In RASKC Foster Home,,Cat,1 WEEK,Unaltered,Domestic Shorthair,White / Black,01/21/2020 12:00:00 AM,Received on,400 W CLOUDY ST,KENT,WA,98032,KENT,,,https://petharbor.com/get_image.asp?RES=Detail&LOCATION=KING&ID=A605904,Image Copyright HLP Inc. 2020,"Received on: 2020-01-21<p/> Found Near: 400 W CLOUDY ST, KENT WA 98032<p/> Description: White / Black Unaltered Domestic Shorthair Cat<p/> Age: 1 WEEK<p/> Current Location: In RASKC Foster Home <p/>",
K20-125152,A606364,Regional Animal Services of King County,ADOPTABLE,https://petharbor.com/pet.asp?uaid=KING.A606364,"King County Pet Adoption Center 21615 64TH AVE S KENT, WA 98032",Integra,Dog,2 YEARS,Spayed Female,Pit Bull / Mix,Tan,01/28/2020 12:00:00 AM,Received on,,,,,,,,https://petharbor.com/get_image.asp?RES=Detail&LOCATION=KING&ID=A606364,Image Copyright HLP Inc. 2020,"Received on: 2020-01-28<p/> Description: Tan<p/>  Spayed Female Pit Bull / Mix Dog<p/> Age: 2 YEARS<p/> Adoption Fee: $100.00<p/> Current Location: King County Pet Adoption Center 21615 64TH AVE S KENT, WA 98032<p/>Hi! My name is Integra and I am available for adoption.<p/><p/>I was brought in by an Animal Control Officer on January 28, 2020.<p/><p/>I am an affectionate lovebug who would be thrilled to cuddle up with you at home!<p/><p/>I am full of energy and I love to play! I tend to calm down more when the people around me stay calm. I do best when I have lots of exercise and something to keep my mind busy.<p/><p/>My caregivers have noticed that I seem to do well with other dogs as long as they are not crazy and bouncing ones. When meeting dogs in a new home, I would do best with a slow introduction.<p/><p/>My personality color is GREEN. I am an adaptable dog who loves to go with the flow! I am outgoing and carefree, and I just can't wait to find my forever home!<p/><p/><p/>",GREEN
K20-125233,A606637,Regional Animal Services of King County,FOUND,https://petharbor.com/pet.asp?uaid=KING.A606637,"King County Pet Adoption Center 21615 64TH AVE S KENT, WA 98032",,Dog,NO AGE,Unaltered,Australian Cattle Dog / Mix,White / Black,02/02/2020 12:00:00 AM,Received on,9000 S 212TH ST,KENT,WA,98031,KENT,,,https://petharbor.com/get_image.asp?RES=Detail&LOCATION=KING&ID=A606637,Image Copyright HLP Inc. 2020,"Received on: 2020-02-02<p/> Found Near: 9000 S 212TH ST, KENT WA 98031<p/> Description: White / Black Unaltered Australian Cattle Dog / Mix Dog<p/> Age: NO AGE<p/> Current Location: King County Pet Adoption Center 21615 64TH AVE S KENT, WA 98032<p/>",
K20-125082,A606117,Regional Animal Services of King County,FOUND,https://kingcounty.gov/depts/regional-animal-services/about-us/overview.aspx,,,Dead Dog,NO AGE,Male,Labrador Retriever / Mix,Black / White,01/25/2020 12:00:00 AM,Received on,12600 57TH AVE S,SEATTLE,WA,98178,KING COUNTY,47.489655,-122.260091,,Image Copyright HLP Inc. 2020,"Received on: 2020-01-25<p/> Found Near: 12600 57TH AVE S, SEATTLE WA 98178<p/> Description: Black / White Male Labrador Retriever / Mix Dog<p/> Age: NO AGE<p/>",
K20-125172,A606476,Regional Animal Services of King County,LOST,https://petharbor.com/PublicDetail.asp?searchtype=PUBFOUND&view=sysadm.v_animal&shelterlist='KING'&where=type&ID=2081511,LOST,Chase,Cat,,Male,Norwegian Forest Cat,Unknown,01/28/2020 12:00:00 AM,Date Lost,SORENSON AND PORTER,,,,JURISDICTION,,,https://petharbor.com/get_image.asp?RES=Detail&LOCATION=PUBLIC&ID=2081511,Image Copyright HLP Inc. 2020,,
K20-124822,A605058,Regional Animal Services of King County,FOUND,https://kingcounty.gov/depts/regional-animal-services/about-us/overview.aspx,,,Dead Cat,NO AGE,Unaltered,Domestic Shorthair,White,01/10/2020 12:00:00 AM,Received on,500 WASHINGTON AVE S,KENT,WA,98032,KENT,,,,Image Copyright HLP Inc. 2020,"Received on: 2020-01-10<p/> Found Near: 500 WASHINGTON AVE S, KENT WA 98032<p/> Description: White Unaltered Domestic Shorthair Cat<p/> Age: NO AGE<p/>",
